320,2021-08-10,アスリート並みの連携で、あっという間に終わった。,4.75,作業は素早いが、荷物の扱いが雑ということは無く、リーダーの全体に対する目配りがとても行き届いている為指示も的確でした。営業さんに「本などの重いものは小さいダンボールに入れて、荷物をあまり重くしないで」と言われたが、小さいダンボールにアルバムが入らず、大きいダンボールに入れれば重くなりすぎるし、かといって他の物と一緒に入れると、物が分散しすぎて荷解きが大変になるしで、とても荷造りに時間がかかった。ダンボールの種類が２種類しかないのもどうかと思う。思ったような荷造りが全く出来なかった。,神奈川,神奈川,午後～15時まで,4,5,5,5,3,11,70,6
313,2021-08-09,とても親切で感じ良かった,4.0,色々しんせつでとても良かった　お二人のチームワークもキビキビしていて感じ良かっもし次回も引っ越しするならお願いしたいと思います　もし知り合いが引っ越しするなら是非すいしょうしたいとおもっています　まずここの会社にきめたりゅうはいちばんに駆けつけていろいろそうだんにのってくれてとても親切なところ　ほかの会社はでんわだけだった　やはり何事もじっこうりょくですね　じっこうりょくはひとをうごかしますね　金額もわがまま聞いてくださったのに安かったです　ただせんたくきの取り付けるぎょうしゃが来たときぶひんをせんじゅうのかたがまちがって持って帰ってしまったみたいで完璧ではなかったのがざんねんですしそれでひようがいったのはちょっとクビをかしげるかな？,大阪,大阪,午前,5,4,4,3,2,8,0,10
331,2021-08-09,信頼できます,5.0,とてもテキパキと作業していただき頼もしかったです。応対もしっかりしていました。もう少し安く抑えたかった気持ちもありますが、安心して引っ越しが終えられました。,静岡,静岡,午後～15時まで,5,5,5,5,7,4,40,5
330,2021-08-07,笑顔がとても良かった,5.0,前も頼んだことがあったので、前回と同様とても素早く、丁寧に運んでくださったので、また引越しする際はアークさんを使いたいと思います。,宮城,宮城,午後～15時まで,5,5,5,5,1,4,30,6
252,2021-08-07,丁寧でした,4.0,整理タンスの中身を出さなければいけなかったのがちょっと大変だったが、丁寧でした。（前に使った会社は出さなくてよかった）金庫も追加料金なしで運んでくれて助かった。農機具などの、汚れ物の運んでくれた。,神奈川,神奈川,いつでも,4,4,4,4,17,10,30,7
338,2021-08-07,細かい質問にも丁寧に対応して下さり即決致しました。,4.75,午前中とはいえ真夏の炎天下の引っ越しで、4階から5階へのオール階段。過酷な激務にあたられた作業員の方々。あっぱれでした。とにかく速い!動く動く!ヒョイヒョイ担ぐ!沢山詰めた筈なのに、なんであんなに軽々と…。3段積みも最初は驚きましたが、抜群のバランス感覚さすがです。カッコいいです。パフォーマンス最高,愛知,愛知,午後～15時まで,4,5,5,5,1,4,10,8
337,2021-08-07,信頼感があり、実際も丁寧な作業で良かったと思います,5.0,訪問見積もりの営業さんから実際の作業して頂いた方まで含めて、信頼感が有り、丁寧な対応でアーク引っ越しセンターを選んで良かったです。知人にも安心して紹介できると思います。,三重,三重,午後～15時まで,5,5,5,5,3,6,10,6
335,2021-08-07,テキパキ動いていた。,5.0,・自分が思っていた料金より安く済んでよかった。・段ボールの引取サービスが行っていなかったのは残念だった。自分で処理するのが大変だと感じた。・作業の方達は、挨拶もしっかりしており、また一つ一つの声の掛け合いも好印象だった。・段ボール回収以外、とても好印象で良かったです。一つ気になったのは、作業しながら段ボールを脇に寄せる時に、依頼者が目の前にいるのに、作業の方が足で寄せていたのが、見た印象的にどうなのかと思った。・それ以外はとても良かったため、オススメ。,埼玉,東京,午後～15時まで,5,5,5,5,4,0,15,6
336,2021-08-07,とても丁寧で対応がスピーディだった,4.0,電話対応から見積、作業までとても丁寧でかつスピーディに対応いただいたのでよかった。荷物の傷の配慮もきっちりしていて安心できた。,富山,大阪,午後～15時まで,4,4,4,4,5,8,40,6
328,2021-08-06,大手で安心できる,4.25,良かった点営業の方、作業の方、暑い中ありがとうございました。金額以上の仕事をしてくださりました。ありがとうございました。,宮城,宮城,午後～15時まで,5,5,5,2,6,5,20,9
318,2021-08-05,柔軟に対応してくれる爽やかな作業員,4.25,【見積もり時の対応】希望の電話と写真画像見積もりのみで対応してくれ、金額も出すのが早かった。【料金】思いがけない金額だったので、非常に助かりました。【作業内容】こちらのお願いにも全ては対応出来なくても、柔軟に依頼内容に沿うようにやってくれ、実際に問題なく出来たのはありがたかった。【全体的な評価】金額と内容については大満足となりました。作業も丁寧で気になる部分はほとんどなかったです。【良かった点】非常に丁寧で柔軟な対応が高評価。爽やかな受け答えも好印象でした。大型家電や家具の取り扱いも丁寧で慣れており、設置のところまでやってくれたのはありがたかったです。【気になった点】特にありませんが、強いて言えば元々の時間より早くに来たので、こちらの準備が出来ていなかったので梱包なども少し手伝って貰いました。,京都,京都,午前,4,4,5,4,5,6,30,6
332,2021-08-04,営業担当者が色々と努力してくれて大変助かりました。,4.5,とても暑い中笑顔で対応してくれて現場で待たせてしまったのに笑顔で作業してくれました。蛍光灯も取り付けてくれて助かりました。何も悪かった点はありませんでした。この度は大変助かりました。ありがとうございました。,神奈川,神奈川,午後～15時まで,3,5,5,5,2,5,20,7
333,2021-08-03,仲良し、力強い,3.75,【見積もり時の対応】気さく【料金】リピーターにため安くなって良かった。【作業内容】テキパキと運んでくれて頼もしかった。【全体的な評価】作業員さんの印象も良く、また利用したいと思った。【良かった点】手際が良かった。【気になった点】当方駐車場が狭く、トラックの出入りが難航した。見積もり時点でわかっていたことなので、営業者は実際の作業員に伝え、対策をするべきではなかったのだろうか。,福島,福島,午後～15時まで,3,4,4,4,3,4,15,6
343,2021-08-03,一つ一つ丁寧に説明してくれてわかりやすかった,5.0,お値段も安くんだし、引っ越し当日はスタッフのひとがめちゃスピーディーにやってくださり、あともってくひとつひとつ丁寧に運び出してくださりありがとうございました。荷物もいっぱいあったのに一瞬でなくなったのでやっぱりぷろはちがうなぁっておもいました。また引っ越しをすることがあったらアーク引っ越しセンターをつかいたいです。,愛知,愛知,いつでも,5,5,5,5,2,7,30,7
344,2021-08-02,丁寧で親しみやすく感じのいい担当者様でした。,4.25,アーク引っ越し会社様に今回の引っ越しをお願いした内容についてのコメントです。■良かった点　　　　　　　　　　　　　　　　　　見積もり依頼後、当日に訪問見積もりをしていただき、価格交渉についても真摯に(上司の方に電話で価格許可を取るなど)対応していただきました。　　訪問見積もりしてくださった担当者様は引っ越しの相場や見積もりの詳細内容など細かく説明してくださりとても丁寧な接客をしていただきました。おかげさまで予算内で引っ越しでき、満足です。また、当日のスタッフも親しみやすく、丁寧かつスピーディーに作業をしていだだけて大変満足でした。　　　　　　　　　　　　　　　　　　　　　　　　■悪かった点引っ越し２日前に連絡があると聞いていましたが前日に連絡が来ました。特に悪いというわけではありませんが他に無かった為コメントさせていただきます。　　　　　　　　　　　　　　　　　　　　　　　　,神奈川,東京,いつでも,4,4,5,4,2,4,15,8
342,2021-08-02,思ったほどには婚礼箪笥に精通していなかった。,3.75,マンションの家内間の婚礼箪笥の移動の依頼でした訪問見積日の即決なら希望に近い金額で組んでくれるということで即決しましたまた婚礼箪笥は得意だからと言ってくれたので依頼しました営業の人はハンガーボックスを貸してくれるように言っていたが当日の人はハンガーボックスは使用せずの入れたままの移動となった。見積書記載のハンガーボックスを使ってもらえなかったのは残念だった婚礼箪笥の組み立てネジの向きが結論として上下の差し込み逆で和箪笥と底板との結合が不具合となる。戻って確認してもらうと私の方で組み立ての部品をなくしていないかと言われ代わりになりそうな部品を買いに行って手当をしたが効果無しで諦めて引き出しを収めようとしたが引き出しを差し込めない状況だったここで部品の差し込みを上下間違えられたんだと気づき、自身で箪笥を横向きにし底板から本体に向けてネジを回したらキチンと止まった営業から婚礼箪笥は得意としているような話だったが現場との乖離がありがっかりした。何度も引っ越ししている経験上、こんなケースは初めてで本当に驚いた。やはり営業マンと当日来られる担当者への安心感は同じではないなぁとまた痛感しました,大阪,大阪,いつでも,5,4,3,3,3,0,0,8
334,2021-08-01,よかった,3.25,作業員2人のうち一人は貴重家具について大切に扱うよう聞いてくれて慎重に扱ってくれたが、もう一人は、聞いておらず雑だった。また観葉植物が茎から折れてしまったのが残念。,愛知,愛知,午後～15時まで,3,3,4,3,6,6,20,10
345,2021-08-01,印象がよくプロの仕事であると感じる瞬間が多かった。,5.0,見積時、引越し比較の初回だったため何件か見てから決定するつもりでした。見積に来てくださったかたは実際に荷物の運搬も経験のある方でかなり具体的にスムーズに話ができました。とても丁寧に対応してくださりその日に決定したことで普通より心の余裕ができたので仕事や体調を崩さずに引っ越すことができました。見積に来ていただかくのも急に決まった中で、夕方から遅くまで3時間くらいかけて対応していただき、見積終了後も車で1時間くらいかけて帰らなければならない担当者さんでした。本当は帰りたいかもしれないのに急ぐ素振りもみせず楽しく見積していただきました。引っ越し当日は担当してくださった方は2名の連携がとれていて、見ていて気持ちのいい動きをされていました。梱包に困っていた物も快く対応してくださりスムーズに運搬ができました。ネジがなめて回せなくなったものの対応など本来、発生が予期できないことにも臨機応変にしてくださりとても助かりました。引っ越しにあたって考えることが多く、脳が疲れ判断が鈍っていたので信頼できる業者さんに巡り会えてよかったです。引越しに不向きな暑さもあり、3回の引っ越しを経験しましたがどの時よりもとても頼もしかったです。,福島,福島,いつでも,5,5,5,5,2,2,20,6
325,2021-08-01,良かった,4.25,電話の時点で引越し代金を伝えてくれた作業がとても速かった冷蔵庫の運搬時、水が出ると知っていなかったのか床に水がこぼれた,静岡,愛知,午後～15時まで,4,4,4,5,4,3,0,6
341,2021-08-01,他社の価格を聞いてから見積りを出してこられた。,4.25,引越プランの説明が少し足りなかったかも。見積り後に、日程、時間の指定が必要になったが、その事で追加料金が発生した。見積り時のプラン内容の説明をもう少し詳しくして欲しかった。,石川,富山,いつでも,4,4,4,5,1,6,0,6
347,2021-07-31,手際が良い,4.5,◯概算見積もりをメールで教えていただけた事。一つ一つの荷物に丁寧にお応え頂いた事。搬入までにしておく事（冷蔵庫の栓を止めておく事など）を丁寧かつ、わかりやすく教えていただいた事。✖︎紙幣の受け取りについて両手で落ち着いて受け取って頂けると良かったかなと思う。,奈良,奈良,いつでも,4,5,4,5,2,3,0,5
346,2021-07-31,高い,4.5,見積時に当日午前は無理なので午後になりますが、フリー便で契約となりますと言われ契約した引っ越し二日前の連絡で9:00からの作業になると伝えられた夜勤明けで午前中に荷物の詰め込み仕上げをする予定だったが、それが間に合わなくなり家族を呼んて手伝ってもらう形でしのいだ作業は早く終わったが、不信感しか残らない,愛知,愛知,いつでも,4,4,5,5,8,7,20,10
348,2021-07-31,アーク引越センター,5.0,暑い中エアコンもなく環境が悪かったのですがテキパキ運んでいただいて、その他対応もよかったです。またお願いしたいです。,岐阜,岐阜,いつでも,5,5,5,5,1,5,10,6
349,2021-07-31,無心に作業をこなしている印象,4.0,暑い中、淡々と作業をこなしていて、必要な事はしっかり聞いてきき、その指示通り行ってくれた。私達の引っ越しの後、他に何件か引っ越し依頼でまた作業がある事を知り、驚いた。　段ボールは無料でありがたかったが、新居で開封した段ボールのゴミは自身で処分するということで、引き取りサービスがあればなと思った。,神奈川,神奈川,いつでも,5,5,3,3,1,0,0,9
311,2021-07-30,一生懸命作業してもらって好印象,3.75,・金額は大手さんは高いとおもっていましたが安くしていただいて一生懸命作業して頂いて満足しています。・月末で込み合っていたようで、こちらの想定時間より遅くなったので時間はだいぶ余裕をみたほうがいいと思いました。・事前に説明してほしかった点として、複合機（レンタル）の付属品を外され放置、危うく捨てるところでした。先に説明があれば引越前に外しておいてバラバラにならないようにしていました。,新潟,新潟,午前,2,5,4,4,11,11,30,8
307,2021-07-30,作業が、早く、時間通りの行程で進めてくれた。,4.0,・段ボールの追加配達や不要段ボールの引き取りなどの、引越前後の対応にも好感が持てた。・終始、時間通りの対応がされたので、見通しと安心感が持てた。・見積もり時に契約をした所、メールにての契約だと、得点が、あったようで、同じ会社の対応として、ちぐはぐさを感じた。・料金は、相応と感じた。引越予定日の直前の対応でもあったので、満足している。,富山,富山,午前,3,4,4,5,3,4,40,5
350,2021-07-30,養生など荷運びの対応が良かった,4.5,【見積もり時の対応】こちらの要望を聞いてくれた【料金】こちらの予算通りにしてくれた【作業内容】養生をしっかりして、荷運びもスムーズだった【全体的な評価】引っ越し自体は問題なかった【良かった点】スムーズな引っ越し【気になった点】電気工事関係の連絡の連携がうまくできていないように感じた,大阪,大阪,いつでも,4,4,5,5,6,10,20,7
340,2021-07-29,営業の人がとても話しやすかった！,4.25,営業の人がとても話しやすくて、細かく教えてくれて良かった！当日の引っ越しも、周りが傷がつかないようにと慎重に運んでくれてよかった！少し押し売りのところがあり、その日の契約なら安いことを強く強調して困った。,愛知,愛知,いつでも,4,4,4,5,6,4,15,6
351,2021-07-29,気配り目配り心配り。あたたかい会社さんです。,5.0,礼儀正しく、暑い中、無駄な動きがなく、素晴らしい作業姿勢で感動しましたメール問い合わせから、訪問見積もりまでのスピーディーな対応と、何より営業の方のお客様目線での気遣い心配りに感動しました。作業してくださった方々からもそのやさしさが感じられあたたかいきもちに、心からありがとうございました,宮城,宮城,いつでも,5,5,5,5,6,0,0,8
352,2021-07-28,営業さんも作業員さんもとても好印象でした,4.5,見積り時の営業さんが、仕事の都合や家庭の事情も考慮してくださりました。最初に見積りを頂いた業者さんは思っていた金額の倍で、考える暇もない程どんどん話を進めてしまったので、不安でした。こちらの業者さんでは、タブレットで細かく確認させて頂けて、家庭の事情を考慮してだいぶお安くしてもらえました。NHKの住所変更の手続きも一緒にやって頂けるとのことで、助かりました。引越し当日の作業員さんも、丁寧な挨拶から始まり、家電もまた丁寧に運んでくださいました。引越し先でも丁寧に配置していただき、運びおわった後も気になるところや変更したいところなど細かく聞いてもらえて良かったです。段ボールの回収も1度だけ来て頂けるとのことで、荷解きがおわったらお願いしようと思います。業者さんにお願いするのが初めてだったので、最初は不安もありましたが、安心してお任せできる方々でした。暑い中、ありがとうございました。,福島,福島,いつでも,4,4,5,5,2,5,20,6
353,2021-07-28,とても好感持てる会社でした。,4.5,電話対応も、嫌味な感じなく押し付ける感じもなく、良かったです。見積もり来てくれた方も、会社を自信を持ってアピールされていました。作業の方も、無駄なく段取りよくされていて敏速にして頂きました。お願いしたベッドの組み立ても、ありがとうございました。,三重,三重,いつでも,4,4,5,5,8,8,20,4
354,2021-07-27,対応が丁寧で社員のやる気が高いと感じた,4.75,良かった点初対面時の挨拶が元気良かった梱包が完璧でなかったが手際良く対応して下さった,愛知,愛知,いつでも,5,4,5,5,10,12,40,9
355,2021-07-27,対応が早い感じがした,4.75,対応も丁寧に聞いてもらえて、自分の引越の場所がまだ決まっていなかったこともありますけど、ある程度の値段で出来たので、安心しました。また利用したいと思います。,愛知,愛知,いつでも,4,5,5,5,2,2,15,8
356,2021-07-25,アーク引越センター,5.0,【見積もり時の対応】満足【料金】満足【作業内容】満足【全体的な評価】満足【良かった点】【気になった点】,大阪,大阪,いつでも,5,5,5,5,2,4,0,10
362,2021-07-25,とても対応や礼儀が良く好印象がありました。,5.0,作業の手際がよく、家具や家電の梱包も完璧でした。荷物の搬出もスピーディーかつ丁寧でとても助かりました。引っ越し先の搬入の際も手際良く丁寧な作業で大満足です。もしもまた引っ越しをする際にはアーク引っ越しセンターさんに是非お願いをしたいと思います。とてもオススメの引っ越し屋さんだと思います。,神奈川,神奈川,いつでも,5,5,5,5,6,3,15,9
361,2021-07-25,相談にも乗って下さりとても助かりました。,5.0,事前にダンボールを多くいただき、ありがとうございました。引っ越し当日は時間通りに３人いらして、暑い中でしたが、一人一人がきびきびした動きで大変良かったです。トラック1台で、2回往復しましたが、スムーズに引っ越しができました。ありがとうございました。,神奈川,神奈川,いつでも,5,5,5,5,7,0,0,10
359,2021-07-25,最初から最後まで対応が良かった印象。,5.0,【見積もり時の対応】値下げ交渉に快く承諾してくれた。【料金】見積もり時よりもオプション料金で高くなったが、納得した結果になったので良かった。【作業内容】とにかく丁寧でテキパキと作業をしてくれていた。【全体的な評価】アークさんは初めて利用させてもらったが結果的にとても良かった。オプションもしつこい勧誘もなく、メリットデメリットをきちんと説明してくれたので納得して付けれた。【良かった点】猛暑で暑い中大変だったと思うが、辛さを顔に出さずに作業してくれていた。みなさん愛想が良くて好感がもてた。搬入の時の養生が丁寧で安心できた。【気になった点】特になし。,大阪,大阪,いつでも,5,5,5,5,5,7,50,8
357,2021-07-24,名前はよく聞いているところなので安心感ありました。,4.5,営業面、対応がスムーズで見積りも早く良かったです。作業面、作業者３名でしたが手際よく作業をしてくれてよかったです。また、機会があれば利用してみたいです。,愛知,愛知,いつでも,4,4,5,5,2,0,0,10
339,2021-07-24,迅速、丁寧という言葉が良く合います！,4.75,こちらの希望や変更などにすぐに対応して下さり、とても有難かったです。当日の作業ととてもテキパキとしており、対応も丁寧でした。金額も対応も満足です！,新潟,新潟,午後～15時まで,4,5,5,5,6,4,15,8
363,2021-07-24,予想以上で大変感激,5.0,電話対応からとても好印象で親身になって聞いてくれて、実際作業員さん達も親切でテキパキしてコロナ禍での作業で猛暑の中でもマスクを外さず徹底していて見ていて心苦しい位でした。引越しは何度かしましたが一番良い会社だと思います。,宮城,宮城,いつでも,5,5,5,5,2,1,0,6
364,2021-07-23,チームワークが良く、気持ち良くやっていただけた。,5.0,段取りよく、やっていた。チームワークが良く見ていて気持ち良かった。急なお願いも快くやっていただけて助かった。料金も他と比較して値引きして頂けた。段ボールの引き取りが有料とは知らなかった。,神奈川,神奈川,いつでも,5,5,5,5,7,1,50,8
368,2021-07-22,作業がスムーズ,5.0,良かった点礼儀正しい　作業がスムーズ　悪かった点衣裳ラックの分解の仕方が荒っぽい価格交渉の際　お客の立場に立ち　価格が限界に来ると他の内容で何とかしようと頑張ってくれた,愛知,愛知,いつでも,5,5,5,5,3,0,15,7
