,引越し時期,タイトル,評価,口コミ,現在地,引越し先,依頼作業開始時間,電話・メール対応,見積もり対応,作業員,サービス,家具量,家電量,ダンボール,見積もり比較社数
1,2023-08-27,とてもいい印象をもちました。,5.0,まず見積もり予約時の電話対応がとても丁寧でよかったです。こちらのペースで引っ越し計画をたてられました。何社か見積もりをお願いしましたが、作業の説明を丁寧にしてもらい、こちらの金額的な要望にも応えてもらえたのでアーク引っ越しセンターさんにお願いしました。見積もり時の対応も好印象でした。見積もりの相場を調べ、できる限り費用を抑えたいと考えていましたが、提示金額も予算よりも安く他社よりもサービスが充実している印象を持ちました。当日はこちらの準備が思うように間に合わず、荷造りの途中でしたが、そちらも嫌な顔せず丁寧に対応してもらいとてもいい助かりました。作業スピードが早すぎてこちらの対応が追いつかなくなる場面があったので作業開始前に簡単なミーティングをしてもらえばよかったかなとは思いました。搬入時も新居を傷付けないよう作業してもらえてとても満足しています。,静岡,静岡,いつでも,5,5,5,5,5,3,10,6
0,2023-08-26,親身になって、引っ越し後の大変さも考えてくれた,3.75,暑い最中に、ありがとうございました。とてもスピーディーに運び出してくださり、助かりました。1点、こうしてほしいなというところがあります。冷蔵庫や洗濯機の下に設置する天板のこと前もって説明くださっていれば、それなりに準備していました。代金支払いの部分で見られたくないところを見られた感がありました。,福島,福島,いつでも,4,4,3,4,4,5,30,6
2,2023-08-26,アーク引っ越しセンター,4.5,見積りの方も感じの良い方で、当日のスタッフもテキパキと荷物を運んでくれました。その日は大安だったので、引っ越しも多いみたいで1か月前に決めたのですが、朝の9時から始めてくださることが出来たので良かったです。高齢者と同居のため、できるだけ午前中から始めて早く終わらせたかったのでこちらの会社に決めました。,神奈川,神奈川,いつでも,4,4,5,5,14,5,90,10
4,2023-08-19,社員教育がしっかりされてると感じました。,4.75,今回はアークさんが一番早く連絡してきてくれたためアークさんに決めたがその後の対応も良く、担当したリーダーさんも人柄、対応、仕事全てが満足でした。電話で伝えた荷物の量より多くなってしまったが嫌な顔もせず快く対応してくれた。荷物の積み込みは思っていた以上に早く、社員教育はかなり徹底されているのがよく分かります。リーダーさんを含めた３名のスタッフさんらは暑い中テキパキと動いてくれたので感謝しかなかったです。まわりに引っ越しを考えている人がいたらアークさんをオススメしたいと思います。※手持ちの段ボールを３つもいただきありがとうございました。,三重,愛知,いつでも,5,4,5,5,2,1,8,5
5,2023-08-15,親しみやすくて良かった。明るい感じの人でよかった。,4.75,【見積もり時の対応】よかった【料金】思ったよりも安くて良かった【作業内容】台風が来てる中やって頂き、丁寧な作業でよかった【全体的な評価】満足【良かった点】明るい感じでよかった【気になった点】台風でもやるってこと。,岐阜,岐阜,いつでも,4,5,5,5,2,4,0,7
9,2023-08-13,以前利用したことがあったので、任せて安心でした,4.75,引っ越し当日に担当してくださった方の対応力（接客面・清潔面）が素晴らしかったです。以前に利用させていただいた時よりも格段に上がっていたので大変驚きました。まさに企業努力を感じました。コミュニケーション力も高い方が多く親近感が持てました。,宮城,宮城,いつでも,5,5,5,4,7,5,30,8
7,2023-08-11,明るいし、早い対応が、助かりました。,4.25,電話の対応が、第一印象大変感じよかったので、緊張したり、どうお願いしたら良いかも戸惑うことなく相談できました。何より、気持ちの良い受け答えが、好印象なのと、リーズナブルなお値段なので、とても助かりました。近いうちに、運び出したいものをお願いできたらと思っています、その時にはよろしくお願いします、,愛知,愛知,いつでも,5,5,3,4,3,1,0,6
3,2023-08-10,作業が速くて良かった。さすがプロ,4.0,【見積もり時の対応】引っ越し業者を頼むのは初めてだったけど分かりやすかった【料金】自分が思っていた金額でした【作業内容】てきばきしていて良かった【全体的な評価】とにかく良かった【良かった点】冷蔵庫の下に敷くマットを準備していなかったけど業者の方が持っていて助かりました【気になった点】なかった,宮城,宮城,いつでも,4,4,4,4,3,4,0,7
6,2023-08-04,仕事が早くて、丁寧。,4.25,見積もり時は作業員2名と聞いていたが、当日は正社員1名か2名、アルバイト1名の3名体制で、トラック2台で来てくれた。引越し時間を選ばないプランで、２日前に当日の時間を連絡してくれることになっていたが、見積もり時の、こちらの希望通りの時間に来てくれて助かった。アート引越センターやサカイ引越センターとは違い、予めタンス内の服は全部出して空にふる必要があり、その分たくさんダンボールを使用するのが環境的に疑問なので改善してほしいのと、こちらも面倒だった。引越作業をしてくれた作業員の方が、見積もり時にお願い済みだった、転居先の照明の取り付けを予定通りしてくれて大変助かった。,大阪,大阪,いつでも,4,4,5,4,13,5,40,6
8,2023-08-03,心遣いが温かい引越し会社,4.5,・ダンボールが足りずに追加購入しましたが、営業所の方の手配もスムーズで、引っ越し準備で忙しい中とても助かりました。・遠方引っ越しでしたが、日程希望を汲み取っていただき本当にありがたかったです。・作業員の方は、壁掛けフック等細かい物も外してくれたりと、心遣いがありがたかったです。・ダンボールのプレゼントがあり、ありがたかったです。・担当の方がお忙しいのか、なかなか連絡繋がりませんでした。その為、一旦営業所経由で連絡していた為、そこは折返しの電話をいただける様にするか何かしら改善お願いしたいです。,宮城,茨城,いつでも,4,4,5,5,4,6,50,6
11,2023-07-30,明るい感じで、とても感じが良かったです。,5.0,荷物が多いけれども、予算を抑えたいという希望に対して、なるべく安く済ませることが可能なご提案をして頂きました。また、引っ越しまでにあまり日数がなく、本当にその日に引っ越しが出来るのか不安でした。荷造りに関して、あまり負担のないようなご提案、例えば、段ボールにしっかり梱包しなくても、袋に入れて口が閉まっていれば持っていきます、家具類の中身はそのままでOKなど、とても助かりました。なんとか予算に近い金額で、無事に引越しを終わらせることが出来ました。業者を決める前には、何度か営業の方に相談に乗って頂き、時間外でも快く対応をして頂けました。また会社の窓口の方も質問に対しても迅速、かつ丁寧に対応をして頂けました。初めて利用させて頂いた会社でしたが、安心して利用することができました。担当の営業の方も、実際に作業をしてくださった方もとても感じが良かったです。新築の家への引っ越しだったので、家、家財を傷つけないように丁寧に作業をして頂けました。本当にお世話になりました。心より感謝を申し上げます。,福島,福島,いつでも,5,5,5,5,3,0,0,6
12,2023-07-30,テキパキしている。フレンドリー。,4.75,訪問見積りにきて頂いた方もフレンドリーで、とても質問しやすかったです。その方の対応の良さで、訪問見積り1社目にも関わらず、お願いすることに決めました。また、引越し当日は猛暑の中、テキパキ仕事をして頂き、大変ありがたかったです。,宮城,宮城,いつでも,4,5,5,5,2,3,20,10
13,2023-07-30,大変良心的で、人間味のある会社,4.0,良かった点今回の引越しが台風2号による床上浸水の報告結果が出て、退去命令を受けてから2週間しか猶予がありませんでした。車も水没して、買い替えをするなど大変な出費が重なり、そのすぐ後の退去…地元の業者に見積りを依頼しましたが、余談は全く無く規定見積りをして値引き、希望価格など一切の会話もなく帰られました。1番の決めては価格ですが、地元でもないのに、他人事ととらえず、最大限の価格を提示してくれました。理由を親身になってくれて、価格面で想像以上に頑張ってくれたので、人柄が会社にも反映されていると思い決めました。大変な猛暑の中、作業終了まで手を止めず頑張ってくれました。悪かった点作業終了後、自分がすぐに確認して、お伝えしなければいけませんでしたが、帰られてから気付いたので…冷蔵庫に２箇所キズがありました。搬入時についた記憶があるかどうか、直接　聞く事が出来ませんでした。,愛知,愛知,いつでも,4,4,4,4,7,7,15,5
10,2023-07-26,希望日に引越し出来るように対応良かったと思います。,4.5,作業する方達のチームワークとても良かったと思います。暑い時期の引越しとても大変だったと思うのに笑顔で対応ありがとうございました。見積もりの営業の方にひと言、エアコン取り外し取り付け工事の件ですが、取り付け工事に三台取り付けして貰う予定だったんですが一台は諦めました。工事料金が、めちゃくちゃ高価かった為、説明不足じゃないのかなぁと思いました。少し残念な気持ちでした。,愛知,愛知,いつでも,4,4,5,5,3,5,20,8
14,2023-07-21,社内教育がきちんとされている社員が来てくれる。,4.0,良かった点コールセンターの対応が良い。営業マンもこちらの日時に対応してくださった。こちらの要望を真剣にきいてくださった。営業マンも現場経験者だったので、詳しく説明してくれて信頼を持てたのでこちらの引越し業者に決めました。ダンボール小25箱、大25箱と、ガムテープ３本無料でいただき、引越し前に荷造りができました。金額が安くなる日時を教えてくれて、少しでも安く見積もってくれた。当日も段取り良く作業してくださり、こちらの要望をきいてくださり、まだ荷物が乗るからと言ってくれて乗せてくれました。冷蔵庫の下に床がキズつかないようにアクリル板を有料でしたが勧めてくれて購入しました。悪かった点3人で来られて、お客様には丁寧な対応だったが、部下に対しては忙しいせいもあるからか？言葉がキツい時もありました。,茨城,茨城,いつでも,4,4,4,4,3,6,30,6
15,2023-06-30,作業は丁寧で受け答えは好意的な印象。,4.25,引越し予定日が迫っていた中で、訪問見積もりから迅速に対応していただき、とても助かりました。なるべく費用を抑えたかったのもあったのですが、そういった部分にも快く対応してくださいました。引越し自体の作業についても、人数が少なく感じましたがとてもスムーズでした。チームの仲があまり宜しくなかったせいか、ポンコツな新人さんを抱えていたせいか、作業中のやり取り・連携の悪さが少し気になりましたが…笑無事に運んでいただき、本当に助かりました。ありがとうございます。,静岡,神奈川,いつでも,4,5,4,4,6,6,20,5
18,2023-06-29,アーク引っ越しセンター,4.5,・7万ほどで考えていましたが　2社で見積もってもらったら　8万前半くらいだったので　相場がそのくらいなのかなと感じました。　なので、人柄や対応、詳しく説明して頂けたことを　考慮してアーク引っ越しセンターに決めました。・他社と同じ価格に値引きを検討してくれて　その場で対応してもらえました。・ダンボールをプレゼントして頂いて　大人2人、子ども1人の世帯には十分な量でした。　ガムテープは一個買い足したので　2個貰えるとより嬉しいです。・アークさんは引越しのプロの方たちが　対応して頂けるので、梱包もしっかりしてくれて　荷物の扱いも丁寧なのでとても安心してお任せできます。　また、引っ越しに要する時間が本当に少なくて　こんなに早く終わるんだ！！と感動しました！　引っ越しのもの以外でも自分たちの車に積んでたものを　持ちますよ。と言って快く手伝って下さいました。作業してくれる方達の印象がとても良く　特にここがおすすめポイントです！！,愛知,愛知,いつでも,4,4,5,5,4,4,30,8
20,2023-06-25,4人のチームワークが良く、手際が良かった。,5.0,自分の準備が悪くまだ整っていない状態でしたが、嫌な顔せず運んでくださいました。ゴミもたくさん付いていて申し訳なかったのですが、ネジの締めなおしなど困ったことにも対応してくれました。とてもありがたかった。,宮城,宮城,いつでも,5,5,5,5,3,2,20,9
19,2023-06-25,見積もりを頑張ってくれる。,5.0,【見積もり時の対応】何度も折り返し連絡して見積もり金額や日程を調整していただき、好印象でした。【料金】月末は料金が高く感じるかもしれないとか、引越し見積もりの概要をとても細かく丁寧に説明していただき、とても親切だなと思いました。以前は月の初旬に引越しを行ったのでとても安かったのですが、見積もりに納得するような説明でとても勉強になりました。【作業内容】不安な点が見当たらないくらい、元気に良く動いて、安心して任せる事ができました。また、家具や段ボール全てに対してとても丁寧に扱っていただきました。【全体的な評価】今回の担当作業員であれば、また利用したいと思うくらい素晴らしかったです。荷物の届け日が翌日という日程で、明日もまた担当するとの事なので期待しています。【良かった点】ネットへの見積もりから数時間後にすぐ訪問見積もりをしていただいてスムーズに契約ができた事。作業員が3人いらしたのですが、3人とも元気よく作業してくれた事。【気になった点】引越し後の段ボール回収を依頼したのですが、有料で3300円（税込）する事。見積もりでとても頑張っていただけたので特に不満があるわけでわないのですが、無料回収の業者さんもあると思うので、次回また利用する際は、見積もり金額に＋3300円で考えてしまうのかなと思いました。今回は、近所に段ボールを回収するゴミステーションがない為利用いたしました。,三重,愛知,いつでも,5,5,5,5,5,4,10,5
17,2023-06-24,非常に良いと思います。,4.5,値段は私が思っていた金額より安く収まって助かりました。室内の養生も品物の養生もキチンとしてくれたので大変良かったと思います。ダンボールは無料でしたが使用済みの回収が有料(3000円)との事だったのでこちらで処分する事にしました。搬出も搬入も動きにムダがなく素早く行ってくれたので15:00からという遅い時間帯からの引っ越しでしたが移動も含めて19:00頃には終えることができたので依頼して良かったと思っています。,大阪,京都,いつでも,4,5,4,5,2,4,10,9
16,2023-06-18,丁寧な作業をする会社,4.25,受付対応からスピード感ある対応で良かったです。現地見積もりも、すぐに来ていただき、見積もり作成もその場でわかりやすかったです。以前、使ったことがある会社だったので、安心感もあり契約しました。段ボール、ガムテープなどの資材の配達も引っ越しより2週間以上前にしていただき、荷造りにも時間をかけることができ、余裕のある日程を組んでいただき、大変助かりました。当日の作業員さんも、挨拶からしっかりとコミュニケーションを取りながら、引っ越しの段取りを取り仕切っていただき、プロの作業でお任せすることが出来ました。率先してテキパキと引っ越し作業を取り仕切っていただきました。時間も思ったより早く完了し、スムーズな運搬、荷下ろし作業でした。荷造りにも一部アドバイスをいただき、非常に助かりました。また使いたいと思える会社さんでした。,愛知,愛知,いつでも,4,4,5,4,7,5,20,6
21,2023-05-30,,4.5,見積もり金額で他社と約５万円安かったが、対応もよく、満足のいく引っ越しができた。引っ越しの10日前くらいに確認の電話があったが、まだダンボールを受領してない旨を話したらすぐに対応してくれた。搬出３名、搬入２名で行ったが、作業はスピーディで早く終わらせることができた。,宮城,東京,いつでも,4,4,5,5,3,6,50,6
22,2023-05-24,人によって異なりますが、とても親切でした。,4.25,【見積もり時の対応】女性の一人暮らしの部屋に、女性の営業さんが来られて安心しました。【料金】値引きしてくださって希望の価格になりました。【作業内容】丁寧で、家具の埃を拭いてくださりました。更に不調だった家具の修理をしてくださり助かりました。また、自分で取り付けしようと思ってた照明も軽々と取り付けてくださり、忙しい荷解きの時間に手間が省けました。【全体的な評価】とても良かったです。【良かった点】家具のネジが緩んでいたり、動作が悪くなっていたスライド部分を直してくださりました。【気になった点】恐らく作業員によってサービスのムラがあるかもしれないなと思いました。【見積もり時の対応】特に可もなく不可もなくです。【料金】満足してます。【作業内容】丁寧にスピーディに運んでくださりました。,宮城,神奈川,いつでも,4,4,5,4,2,4,15,8
23,2023-04-30,電話での説明がわかりやすい,3.5,まず、一番良かったことは最初の電話対応で価格の目安や、作業の流れなどを説明してくれたこと。トラックや作業員の手配もあると思いますので、最初の電話でこちらの意思を固めてくれるアプローチは、こちらにも、引越し業者側にもメリットがあると感じました。他社の最初の電話はオペレーターの方がスケジュールを確保するだけの電話でしたが、最初から「引越し業務が理解できているプロ」が電話をしてくれて、その場で概算見積もりや、トラックのサイズ、１日の作業時間の流れなどのイメージを話してくれたのはとても安心につながりました。見積もりに来て頂いた担当者は電話の内容をきちんと把握されていて、再度説明したり、電話の内容と異なることが無く、スムーズでしたし会社として信用できました。最終的に当日の作業は計画通り進み滞りなく引越しが完了しました。当日の作業は可もなく不可もなく。と、いった印象でした。総合的に満足なのは、やはり最初の電話での対応に尽きると思います。ありがとうございました。,愛知,愛知,いつでも,4,4,3,3,11,7,20,4
24,2023-04-30,120点満点の素晴らしい対応でした,5.0,【見積もり時の対応】経由地という特異事項に対しても、柔軟に対応し、より良い提案をして頂いた。【料金】三社比較のうち、最高値の約半額でした。【作業内容】迅速・丁寧で安心な作業でした。【全体的な評価】120点【良かった点】営業・作業員共に満点です。【気になった点】特になし,三重,三重,いつでも,5,5,5,5,2,1,40,5
25,2023-03-31,丁寧でよかった。知名度は低いが対応はよかった。,4.5,【見積もり時の対応】すぐにかけつけてくれた。【料金】時期が繁忙期なので高かったが、相場がよく分からないのでしかたないかも。他社よりは安かった。【作業内容】丁寧でよかった。【全体的な評価】よかった。【良かった点】責任者がしっかりしてた。うまくメンバーを活用してた。【気になった点】とくになし。,大阪,大阪,いつでも,4,4,5,5,3,5,30,5
35,2023-03-31,親切でした。,4.75,生まれて初めての引越しで右も左もわからない状態でしたが、見積もり時から親切にご対応いただきました。時期的にもお忙しい中タイミングにも関わらず、お時間なども融通きかせていただきありがとうございました。,愛知,愛知,いつでも,4,5,5,5,3,4,5,5
36,2023-03-30,親切丁寧でした,5.0,【見積もり時の対応】わざわざ遠方からでしたが時間通りに来て頂き、他社を悪く言うことなくご案内していただけたことがとても好印象でした。【料金】初めてで相場もよくわかっておらず他社との比較も出来ずでしたが、良心的な金額を提示して頂き助かりました。【作業内容】無駄がなく、迅速丁寧な対応で感心しました。【全体的な評価】先に他社にも見積もりを依頼していましたが｢ここで決めて頂かないと｣と少し強引な言動や、他社を批判するような言動があり、それに比べ後から来ていただいた業者さんは他社を悪く言うことなく自社をアピールし、好印象で信頼できる業者さんだと感じたので依頼を決めました。ちなみに先の業者さんにキャンセルの連絡をした際に、かなり下げた金額を改めて提示されましたが、それはそれで逆に不信感を感じてしまいました。,長野,長野,いつでも,5,5,5,5,3,0,0,6
32,2023-03-30,これまで利用した会社と同等以上でした,5.0,これまで3社ほど利用しましたが、サービス内容は同等でありながら料金は2/3ほどでした。作業員の方も対応やスピードも申し分なくとても満足しています。日程がタイトでしたので、短時間で比較できたことも満足度向上に貢献していると思います。,愛知,三重,いつでも,5,5,5,5,1,5,15,6
31,2023-03-29,真摯に対応していただき仕事も丁寧でした,4.75,繁忙期の引っ越しのため、電話の時点で断られることもあったが、訪問見積もりを即日行ってもらえたため、とてもありがたかった。初めて引越しを業者に頼んだため不安だったが、引越し作業も丁寧で、安心して任せることができた。,宮城,宮城,いつでも,4,5,5,5,5,6,15,7
