at,score,content
2022-12-08 15:38:21,3,最近、いわゆる『シミ』と呼ばれていた需要を示す色付き表示の色が紺色のような色に変わりましたが、 その『シミ』がマップの道を塗りつぶすように表示されてしまい、『シミ』が出ている範囲のマップが、とても見づらいです。以前は道を塗りつぶすような表示ではなかったはずです。 ダークモードの場合は、真っ白に塗りつぶされているので色の問題ではなく表示の仕方の問題のようです。 とても見づらいので、早急に以前の仕様に戻して欲しいです……！
2022-12-07 20:04:55,1,お客様の配達先のメモが分かりづらい場合でも一方的に配達員の責任となります。お客様がアーチ状というのを理解出来ていないで使っている場合でも指摘すら出来ません。
2022-12-07 19:52:53,1,需要の高いエリアを示すグレーの部分がどれだけ拡大しようとも地図、道路が見えるようにならない為、非常に不自由しております。 iPhoneではある程度拡大すると見ることができるようになり、問題ありませんでした。 そもそも、ピーク予想や今回試験導入されている特定の店舗名まで表示する機能は自分で注文の多い店舗やエリアを見つけていた側からするとライバルが増え収入が減るだけなのでやめて欲しいのが本音ですが…。 収入を下げるような変更ばっかり… 　　 あと、ヘルメットクラブにすぐに参加し、その特典はもらえましたが、 10月31日を過ぎてからも全くヘルメットの着用写真の撮影を求められないです。 これでは、いつまで経ってもヘルメット奨励金の方がもらえないです。
2022-12-05 13:21:59,1,今週クエストないんですか？ 嫌がらせ？
2022-11-24 03:17:13,1,オーダを受けないのでXボタンを押そうとしているのに受けてしまったり、他の部分を触って受けてしまったり、端末を操作中にオーダが来て何も見ずに受けてしまったり、受ける所を押さなくても受けてしまう。受ける動作をスワイプにするなど、受ける受けないを確実な動作にしてほしい。今はマルチタップになってしまっている。 他店舗ダブルも一店鋪ダブルも行先ルートを表示してほしい。そうでないと、ダブルは行きたくないピック店鋪、行きたくないドロップ先の区別が付かなくて受け辛い。配達員が到着してから作成するなど、平気で長時間待たす店鋪にはピック行きたくない。忙しいから作れないとか言って、こちらから強制キャンセルさせるのを繰り返ししている。それを長時間待ってドロップするとこちらにBAD評価される。店鋪側には何のペナルティが無いのだから、待たすなど何とも思っていない。
2022-11-24 03:04:47,1,同じく、ダブルピックの一軒目で、二軒目も、自動的に配達完了。。。 楽で良いけど。 誰が届けるんです？ サポートに、連絡するも３件待ちって。 サポートに、連絡ついたら既に、5分。確認に5分。配達先に確認するのに10分。 当然キャンセルするよね。 サポート要らないから、アプリ上で、直近の、配達完了取り消しとか、配達先の住所とか、確認出来る様にした方が全然良いと思いますけどね。 今回ので、BAD付くのは確実。 サポートにBAD ★5 進呈 サポートになってない。
2022-11-24 03:04:00,1,最近iPhoneからAndroidに変えました。 リクエストが来た際にピンチアウト、ピンチインが出来るのが良いくらいであとは全部iOS版の方が良い。 まず、オンライン状態で他の事(Twitterや調べ事)をしてるとそこにリクエストを被せてくるので誤タップが多くなった。 Android版もポップアップ上に出せるようにして貰いたい。 次に、マップが見づらい。iOS版に比べて建物の境界の線が細いというかなんて言うかとにかく見づらい。 マップアプリもグーグルマップだけではなくヤフーマップを使いたいので選ばせて欲しい。 毎回ヤフーマップを開いて住所入力がめんどくさい。 次に、評価に関して理由がその他の場合の低評価はフィードバックが無いので改善のしようが無い。
2022-11-24 01:51:51,5,バージョンアップした際、何が改善されたか、教えてほしいです。
2022-11-24 00:24:55,1,最近10km以上距離がありピックからドロップまで50分以上かかるオーダーがよく来る。それで報酬が600円とか700円。単発アルバイトやってた方が確実に稼げますね。あと、配達リクエストボタンが最前面に出てきて、ボタンも大きく、他アプリ操作中に誤タップでリクエストを取らせるような狡猾な仕様、いい加減やめたほうがいいのでは?サポートも電話が無くなりチャットのみになったが、相談まで行く手順が多く早くお客様に届けたいのに応答のレスポンスも最悪、面倒事には関わりたくないという印象しかない。殆どがアプリの不具合によって起こってるトラブルなのに無責任過ぎ。そんなにサポートしたくないならマシなアプリを作れ。運営の汚さがアプリにも現れてます。
2022-11-21 20:40:40,1,電話もチャットサポートも廃止されたので全く連絡が取れない。料金に誤りがあっても泣き寝入りするだけ。 あとお客さんとの電話がすぐに切れる。繋がってすぐに切れることもあるししばらく話していて突然切れることもある。 電話はアプリの品質とは関係ないですがサービスとしての愚痴として書かせてもらう。
2022-11-20 20:21:31,5,自分に向いてる仕事なので、いい仕事です
2022-11-20 18:32:21,1,数年ぶりに復帰、糞システムは相変わらずで基本料金が高い他社と仕方なく併用、質より量は相変わらずなので他社が暇な時にやってます。相変わらず300円代案件多数、800円案件は基本ダブルピックで客の名字が一字伏せられた状況で手探り配達、客の情報も更新しないままで言いたくないけどバカだろ、と　手前が食うものさっさと配達して欲しけりゃ明確な目印は当たり前だろと、それでいつまでも来ないとかアプリのレヴュー見てるとツッコミ満載、ホント客も質より量でそのまま放置のuber社も勿論改善するつもり無し　勝手に現金扱い設定すんじゃねーよ糞運営
2022-11-20 13:31:24,2,配達中にネットワークエラー多発。配達にならん
2022-11-19 13:21:43,1,不具合ばかりで使い物にならない。配達して完了しようにも頻繁にばくがなにかわからないが完了ボタンが表示されず完了できない。サポートに問い合わせてもトラブルシューティングしろとゆうだけ。稼ぎたくて登録したのに時間ロスばかりさせて全然稼げない
2022-11-18 23:06:12,1,起動しません❗仕事出来ません。迷惑です。戻し方教えてください
2022-11-18 15:54:54,1,ダブルオファー表示時のドロップ先表示が必ずしも最終ドロップ先とは限らなくなりました。 本日、表示が埼玉県吉川市ドロップのコストコダブルを受けたところ、最終ドロップ先は東京都文京区でした。 吉川市の表示は1件目のドロップ先でした。 28kmも違うところ表示しないでください。
2022-11-13 16:11:44,1,重い。
2022-11-12 18:41:26,1,ダブルピックの際に行き先の住所もピンも見れず、二軒目分の配達料も2ピック2ドロップの割に合わない安さです。配達に時間もかかりますので料理も冷めます。 あまりにもウーバー社にしかメリットのない最低最悪なアンフェアな改悪だと思います。
2022-11-02 00:55:37,5,注文を受けたらお店への到着目安時間とお客様のご自宅到着予定時間を表示していただきたいです
2022-10-31 13:22:03,1,メッセージ送信画面の例文はいらない。 いつも、間違えてタッチして誤送信してしまう。 特にAndroid12のジェスチャーナビゲーションとの相性は最悪。 なくして欲しい。
2022-10-26 17:08:00,1,お届け先に近づくと勝手にアプリが閉じる。 最近は１日に何回も写真認証。 改悪ばかり。
2022-10-25 13:06:34,1,このアプリを使わないと仕事できないにも関わらずバグを一向に直さない糞アプリ。ちまちま設定を自分好みに変えてもすぐ初期化。アプリ起動→「使用言語を選んでください」もう何十回選ばせるんねんキャッシュで保存すれば済むやん。でもこんな当たり前のことすら出来ないアプリです。地図上のピンずれはもはやお家芸レベル。それで配達が遅れても配達員であるあなたの評価が下がるだけ。ベテラン勢の方なんかもう話題にすら出しません。バグが原因でお客様から怒られることもありますしウーバーに言っても改善はされない。ゴネればむしろ鳴りを減らされたり垢BANのリスクが増すだけです。ウーバーさんよ…お願いだからバグフィックスだけしててくれ…使い勝手改善しました！じゃないんよ。そんなんよりもまずは不具合を潰して…
2022-10-25 01:56:11,5,最高
2022-10-23 00:21:55,3,普段からお世話になってます そろそろ現金払いOFFなのに現金払い案件流すの勘弁して下さい💦バグならバグで早期修正お願いしますm(_ _)mこういうバグが続くので有れば続けられません
2022-10-22 13:04:24,1,改悪。逆方向のダブル毎回のようにピンズレ。 なんのためのアプデなん？使えないエンジニアは変えた方がいい。
2022-10-21 07:02:58,5,素敵
2022-10-20 17:33:26,5,超最高 ・ω・ b ♥
2022-10-18 11:25:26,1,①現在の自賠責がまもなく切れるから新しいのアップしろとアプリから警告→②新しい自賠責をアップ→③まだ期限じゃないから現在の自賠責をアップしろとアプリから警告→現在の自賠責をアップして①に戻る、を一週間やってます。 まともなSEいないの？
2022-10-15 10:47:46,1,使用していないのに裏で動いてバッテリー消費しているのは何の為なんだろう
2022-10-13 20:14:25,1,これから始める人も始めたばかりの人も気を付けて下さい。 私はドライバー始めてまだ1ヶ月 配達40件、ゴールドランクになり現金取り扱い可能になりました。 ですがお釣りを用意するのも面倒でそのまま設定しませんでしたが、かってに現金取り扱い設定ONになってました。 それに気が付かず、お釣りを用意せずに配達。1万円札を出されましたが、お釣りを用意してない私とお客様もどうしたらいいかしどろもどろ。 結果私が急いで近くのコンビニで釣り銭を用意してからもう一度お客様にお会計して事なき得ました。 ドライバーアプリはサポートが不十分で電話対応はしてくれません。 トラブル時は本部とチャット対応のみですが、チャットもどうやったら開けるのかとても分かり辛いです。 トラブル時は1分１秒でも速く解決する為に、電話でのトラブル対応をして欲しい。
2022-10-13 12:15:09,1,不具合が多すぎて　何時までも改善されない
2022-10-10 20:53:55,1,サポートとの連絡体制がイマイチ。 オンラインにできなくて困っているのにサポート側の対応は定型的なもので、一向に解決の糸口が見えない。 担当者同士の連携も取れていないんじゃないかなと思う。 使えない故に使い心地に関しては中立の3つ星にした。
2022-10-07 08:03:15,1,オペレーターは対応したと言っていても実際は対応していないことが多々ある。 同じ問い合わせの返信であるにも関わらず何度もオペレーターが変わり同じ話の繰り返し。
2022-10-01 11:05:02,1,とにかく使いにくい！ すぐバグるし説明文もわかりづらいし作り方が雑すぎます！ やっぱ米製アプリは駄目ですね。 信用ならん。 1年経っても改善されません。 いつまでバグを放置しておくんだよ。 ちゃんとしやがれ能無し無能運営の馬鹿どもが。
2022-09-30 23:53:02,1,使ってみればわかる 星ゼロです
2022-09-27 09:12:17,1,ポッケに入れてリクエスト鳴り確認しようとするとキャンセルに成りやすい！ グーグルとシステムタイアップしてるせいで、配達したことの無い人の意見を取り入れすぎ、レストラン側ではフルネームで名字が先、名前後で記載されてるのに、ドライバー側は名前が先、名字が後、表札で動いてるのに名字以外表札に書いて有るか？ここは、アメリカじゃないぞ！色々と使いづらいアプリ俺でも作れるわ(笑)仕事してストレス貯まるのUber Eatsだけ
2022-09-26 17:19:31,2,そろそろ評価の制度なくしてほしい。配達員にとってストレスでしかないし誰も得しない。
2022-09-25 11:46:47,1,・(〇回配達)等のプロモーションが数ヶ月来ていない ・依頼中に新しい依頼が来ても地図のルートが表示されないので金額や住所で判断するしかない。300円で近場かと思ったら30分くらいかかるロングを掴まされたことがあるのであまり信用出来ない。 ・目的地がかなりズレてるときがあり、あまり信用できない。 ・最近やたら賃金が下がった気がする1.6倍補正で300円とか舐めてるのか
2022-09-24 11:10:36,5,つかえる!
2022-09-23 18:24:50,1,リクエスト時に受け渡し場所を提示するならピック中も受け渡し場所を明記してほしい、マップ画面を拡大縮小すると画面が一時的に固まる リクエスト時お店の名前が出ない 配達中のリクエスト時は届け先が出ない
2022-09-22 14:27:54,1,お客様情報をタップすると真っ白な画面になるのと銀行口座情報の変更の編集ボタンを何度押しても画面が元に戻る不具合があり、銀行口座がちゃんと登録されてないのか給料が振り込まれません。サポートの対応も定型文ばかりで電話もできないためどうしようもないです。
2022-09-20 14:08:32,1,登録までがめんどう。イライラする対応。機械的で融通が利かない。何がエラーでできていないかわからないのでいちいち止まって時間が取られる。アメリカのIT企業？
2022-09-19 07:18:28,5,革命的
2022-09-18 09:56:32,1,マジで使えないこんなにシステムエラーばかりのアプリも珍しい他のデリバリーアプリの優秀さを見習って欲しい！！ お客様の所に持って行く時ばかりエラーエラーエラーエラーエラーエラーエラーエラーマジで迷惑！！
2022-09-17 22:05:15,1,バグだらけ
2022-09-15 23:22:42,2,ピン位置と住所が違う場合や逆の場合、住所又はマンション名でのどちらかで他のアプリで検索かける必要がでてくる。しかし、このアプリは住所やマンション名がコピー出来ないので手入力になる。手間と時間がかかりすぎる。マンション名住所はコピーできる様にしてほしい。 お客様が正確に住所等を入力しているのに配達員には正確な情報提供されない場合がある
2022-09-14 16:59:07,1,稼働するだけしたあとで、支払い口座の登録で何度もエラーがでる。 何万も支払われないまま連絡も取れない。 詐欺としか言えない。 金を稼ぐためにやって、金が払われない。
2022-09-14 14:37:24,1,他の方も書いているが、雨の日のインセンティブが発生しますのポップが表示されていても機会からチェックすると何もない。実際に稼働していてもインセンティブは発生しない。サポートに問い合わせると私にはクエストはない、次にポップが表示されたときはスクショして送ってほしいとの返答。 また、機会の詳細を確認すると←で戻れなく再起動するしかない。早く改善していただきたい。
2022-09-11 20:50:29,1,わいの機種は未対応なのかもしれない
2022-09-10 23:23:45,1,サポートに問い合わせ出来ないのが最悪。対応時間外だからなのかもしれないが、そもそも深夜2時まで営業してるんだったらその時間までサポート対応してなきゃおかしい。
2022-09-10 13:51:25,3,配達先の顧客名が中途半端にしか表示されないので、一戸建てへの配達やホテルへの配達時にはお客様名不明のままなので非常に困ります。一戸建てでは最終的に表札確認が出来ない場合かあるので致命的です。 フルネーム表示してくれるよう早急の改善を求めます。
2022-09-09 21:18:00,1,他の方も投稿されていますが、私は9/8からリクエスト画面が半透明になり、なかなかタップできず時間切れスルー扱いされてます。着信音も物凄く遅れて１回だけ鳴るので、配達中気づかないこともあります。またタップしても待機画面に戻り時間切れだと思っていたら、数分後、いきなり配達画面に替わります。ドライバーアプリからナビへもクルクル回ってなかなかナビにならないし、配達完了もクルクル回ってなかなかできません。今回のバグは至急直してください。
2022-09-08 18:23:08,1,距離報酬が安すぎる。おかしい。
2022-09-08 11:25:45,1,マジで今までなかった致命的なバグ増やして対応しないのやめてくれ
2022-09-08 01:23:56,2,お客様情報が見れなくなりました。 クエストの進行状況を表示すると戻れなくなります。至急対策お願いします。
2022-09-07 21:14:15,2,自転車から原付配達に変更しようと思って少し無理して購入したのに変更手続きをしたら最初の自動返信すら送って来ない。半端に進行していたクエストが消えていたので何らかの審査は始まっていると思いたいが確認出来ないため待つしかないと言うのは非常に不安。生活がかかっているのだからサポートはきっちりやっていただきたいです。
2022-09-07 00:52:51,4,だいぶ使いやすくはなったと思います。 ただ、クエストの詳細を開いたあと戻れなくなってるバグがあるのでそれは直して欲しい
2022-09-06 17:45:06,1,インストールできない
2022-09-04 14:25:12,3,大分改善されてきて使いやすくなっています。 欲を言えば稼いだお金でそのままウーバーの注文ができれば便利だなと思いました。
2022-09-03 05:42:55,5,とても良かった。勉強になった。
2022-09-01 15:39:48,1,クエスト進行状況を開いて戻らない問題を早く直して欲しいです。
2022-09-01 12:33:40,1,依頼がくるたびにUターンしなければいけないのはどうにかならないでしょうか？ 帰宅ラッシュ時間等はUターン困難な事が多く、時間がかかってしまいます。 進行方向のお店からの依頼をくれると助かるのですが…
2022-09-01 12:30:23,1,機会 観覧すると 戻れなくなる
2022-08-31 17:36:02,1,クエストの詳細みるとフリーズする。 あとお店やお客さんの情報見る時になんか引っかかってウザい。 早急更新お願いします。
2022-08-30 18:35:34,1,お客様情報が見れなくなった。 熟成かどうかがわからない。 非常に困ります。
2022-08-30 16:04:34,1,携帯を触ってるときに急に案件がポップアップされ、不意打ちで受注されることが多々ある。普通は確認のメッセージがあるものじゃないのか？ サポートセンターに電話できる機能が分かりにくすぎ。 サポートセンターになるべく電話がいかないようにしているように見受けられる。まったく誉められた体制ではないですね。
2022-08-29 15:32:19,1,バグがあっても治さない。サービスの不都合を見つけて指摘しても改善しない。
2022-08-29 10:14:24,3,悪くない けど操作UIが分かりづらい マップがGoogle mapにしか対応していないのが辛い 車ならいいが徒歩や自転車、原付は通れる・通れないが道路によってあるからNAVITIMEなど選べるようにしてほしい
2022-08-28 15:57:33,1,全く稼げなくなっている、もう少し自転車で配達している人達のことも考えて欲しい。バイクばかりが優遇されていてつまらない。
2022-08-28 00:13:39,3,クエストのページに入ると元のページに戻れなくなってアプリを閉じて再起動しないといけない。
2022-08-26 20:32:54,1,バグ クエストの詳細画面から戻れない アプリを終了しないとダメ 早く直して下さい
2022-08-24 16:37:54,2,クエストの進行状況画面を開くと戻れなくなる。 届け先付近になった時に次の依頼が来るのは良いが、画面に大きく表示されて何も見えなくなり邪魔。
2022-08-23 11:48:01,2,アンドロイドだと地図が回転しない。iosだと目的地方向に自動で向く。せめて手動で地図を回転出来るようにしてほしい。 あと地図のコントラストがあまり無く、道がわかりにくい。
2022-08-23 11:18:08,1,注文受信したときの音が途切れ途切れになる。 配達完了をスライドしても、次の画面に切り替わるのがめちゃ遅い。 さっきのにも準ずるけど、置き配時に画像反映されるのが遅い。 など、不具合をあげりゃキリがない。はよ、改善しろ。Wi-Fi繋げてても、こういう状態
2022-08-23 06:19:57,2,アプリリニューアルしてから、クエスト画面見たらフリーズしてメイン画面等戻らない再起動しないと元に戻らない。 再インストールしても同じ症状 スマホAndroidソニーエクスペリア最新機種 機種によってなるのかわかりませんが、至急改善お願いします。 また、売上明細と合計金額が合わない事が多々あり売上明細金額のダブリが多々あります。改善お願いします。
2022-08-22 19:18:56,1,サポート体制が著しく弱い。他社にない強みがあるがゆえの驕りを強く感じる。出来るのであれば他社に乗り換えたい。
2022-08-22 06:08:17,1,このアプリのマップのままで向かう事が多いが、移動の途中、特にもうすぐ着きそうな重要な所で点滅したようになって動かなくなる。お客様の置き配が反映されないバグもある模様。低評価を集める爆弾装置。各配達員いつアカウント停止されてもおかしくない。
2022-08-22 03:29:56,1,Uberはまじで糞。 特に、サポートは星1どころかマイナスです。配達員が客になることも有り得るのにものすごく対応が悪いです。ある程度成長し認知され調子に乗っているのでしょうか？小さい火種(不満)はいずれ大きな炎になることがわからないのでしょうか？
2022-08-19 22:23:35,2,軽微なアップデート？修正？改悪？がたびたび行われているからか、開くとどこか変わっていることが少なくない。そのことの通知が全くないから困る。 今回は、クエストを開くと、戻れない状態発生。いちいちアプリ再起動が必要。何をいじったのですか？ あと、クエストを選択式に戻してください。
2022-08-19 20:49:21,1,何で住所コピー出来ないのか謎だし優秀な地図アプリのゼンリンと連携出来るようにして貰いたい
2022-08-19 12:15:24,3,受取り側の正しい情報を送って欲しい。 ただ希望はそれだけ。 住所が変更されましたとか余計な情報は要らない。
2022-08-14 15:08:53,1,サポートセンターと連絡取れない❓どおすれば良いの⁉️教えて
2022-08-14 07:17:12,5,ウーバーイーツいつでも、どこまでも
