at,score,content
2021-10-05 22:37:52,1,一度も現金配達してないのに制限された。サポに連絡したら紆余曲折経て漸く解除された。しかしこんなことはまだかわいい方だった。突然垢停になった。機器認証がどうのと出てきたが(ググっても)該当案件はなし。…しかしサポに凸てみたらあっけなく復帰。アプリの不具合とのこと。os最新だの機内モードだの再インストールだの並べてましたが…、この何の前触れもなくいきなり垢停にくらべれば他の理不尽など些細なことです。皆さん、とにかくウーバー1本でやるのは絶対やめましょう。ドーナツさん、私もその1人になってしまったようです。仰る通りこんな所(1本)で働くのは危険極まりないでしょう。必ず副業(他に収入源がある状態)でやりましょう。あのですねウーバーさん、これ生活かかってるんですわ。いえ明確に此方に原因があるなら仕方ないと思えますよ？ 私が言ってるのは唐突極まりないアカ停です。序に最近ピンずれが酷すぎます。Google Map、Uber 地図共に話になりません。そして極めつけはアプリ、店、客側のせい…全て配達員が貧乏くじひかされます。配達員を大事にしてるとは世迷言でも到底無理。ほんと配達員いなくなりますよレベル
2021-10-05 22:16:57,1,配達報酬額がメチャクチャ。1.7kmで300円の後に8.2kmで382円は酷すぎる。この報酬額では請けれない。 しかもこっちはバイク使っててガソリン代がかかる。その分だけ配達所要時間は速いのに相変わらず自転車と同じ。 今年の5月以前の仕様に戻すべき。本当に、酷すぎる。
2021-10-05 19:30:23,1,アカウントは有効になっているのにオンラインにできず出発できない。 問い合わせしてアカウントが有効になっているのも確認し、オンラインにならないことを伝えたが解決方法は教えて貰えずで使えない。
2021-10-05 10:47:22,1,アプリ障害が酷い。 売り上げが正しく出ない事はザラだし。 今日なんかオンラインできないとか酷すぎる いくらなんでもナメ過ぎ。
2021-10-04 21:31:09,5,まんじです
2021-10-04 15:10:06,1,ゴミアプリ
2021-09-30 21:21:55,1,インターフェースがゴミ どこになにがあるかわかりずらい
2021-09-29 11:30:45,1,全く信用できません！リストに有る大和ネクスト銀行を作ったら後にカードの無い金融機関はダメだと拒否され続けるので辞めました！
2021-09-28 20:10:10,3,売り上げが表示されないことがたまにあって困ります。
2021-09-28 13:30:39,1,全然鳴りません。丸一日通知無し。アプリもバグだらけ。
2021-09-27 02:06:33,3,真面目にやってる配達員を不正と検知してアカ停になった配達員が複数いるそうです。暫くウーバー稼働は怖いので控えます。アプリは使い勝手良いけどサポートの返事はとても遅い&テンプレなお返事しか帰ってこない。数日前に送ったヘルプのお返事いつくれるのかな？
2021-09-26 12:24:10,1,　　　　　　　　使いづらい
2021-09-23 17:34:20,3,恐らく元が海外のアプリだからでしょうか？操作性に色々と難しい部分があります。 グーグルマップが反映されない場合が多く、その場合は店舗や相手先の住所をコピーできないため頭で記憶して、グーグルマップで手入力が必要になります。 この部分が非常に手間取り焦ります。 それと、配達中は今とは逆に自動でオフラインになって欲しいです。 やりたい人だけ自分でオンラインを継続させる方向がより良いと思います。 また、置き配の場合ですが、相手先に到着した際に行うことが、「荷物置き、写真撮影、評価、コメントの入力など」です。 意外と多く焦り、順番を間違えるとコメント書いたり評価をする前に送信されます。 この時にもう少し詳しいボタン操作を増やしたほうが良いかもしれません。 例えば、 ・まず写真を撮ってください。 ・次にコメントを書いてください。 ・最後に評価をしてください。 といった感じの流れがあり、それに従って勧めたほうが無難です。 色々と指摘をさせてもらいましたが、より改善に繋がると思うのでご容赦ください。
2021-09-23 14:30:35,1,登録完了が遅すぎるカードなど何回も綺麗に写真撮ってるのにもう1回撮らされたりさっきなんか知らない人の写真が出てきて同一人物の可能性？とかなんか言われてもう1回撮らされました。書類等は写真じゃなくて直接書き込めるようにしてください
2021-09-21 23:09:56,1,チャットで催促しないと最終チェック来ない。そこから48時間で認証…今月中から働かないとマズイんですけど… …おかげで大損。 9/21追記：ヘルプからどんなことをしようともチャットサポートに行けない。メールでの返信がチャットに来ているようだけど見れない？あと売上の内訳がサーバーエラーで見れません。対処お願いします
2021-09-21 22:03:50,1,ただただゴミアプリ、元々の仕様の改悪、プロモーション減少、キャッシュカード登録のヘルプの日本語が可笑しい
2021-09-21 16:08:00,2,3コインアプリ
2021-09-20 00:11:45,1,配達報酬300円均一開催中!! アホらしくてやってられんわ 報酬の詳細もブラックボックスでドライバーには分からないからと不当に低い報酬で働かせるのはどうかと思う
2021-09-19 23:55:15,1,まず、Googleマップの精度が本当に本当に悪すぎる。ゼンリンと提携解除した罪は重い。そして勝手に現金オンになっていて、デフォルトでもオンになる。コロナ過で自宅待機者が利用してて感染したらどう責任とるんだ？冗談じゃない。怒りで震えそうだ
2021-09-19 11:22:34,2,注文番号に拡大表示できるようにしてほしい。ピンずれ修正依頼や表札や建物名の依頼を簡単にしてほしい。駐輪場の表示もしてほしい。
2021-09-18 21:59:59,5,とても使いやすいです
2021-09-18 14:08:37,1,アカウント開設まで一体どれだけ掛かるのでしょうか。。。
2021-09-18 01:13:09,3,配達完了のグラフの日付がズレている
2021-09-17 17:46:13,1,ゴミアプリ
2021-09-17 13:58:05,1,重いし、わかりづらいし、使いづらい
2021-09-16 10:27:47,1,対応遅くてやる気ないUberEATSよりも対応早くて報酬も良い出前館の方が好きです＾＾
2021-09-15 16:15:38,1,注文者の住所のピンずれを何とかしてほしい。あと部屋番号とか建物名を抜かしてる人が多い。そんなので配達出来るわけがない。向こうの入力ミスなのにこちら側が負担するのはおかしい。Uber側から定期的に利用者に住所の見直しや、注意喚起を促してください。 あとカスタマーセンターの対応が悪い。対応が遅すぎる。平気で一週間返事が来ない。こっちは生活がかかっていて今すぐ電話をしたいのに、電話をするには予約を取らなければいけないらしく、３週間先まで埋まっていて予約が取れないのは何なの。海外の企業だからか、アプリやサイトも尋常じゃなく見にくい。ましてやUberからの電話は非通知で来るなんて事前に聞いてないから、非通知拒否設定していたから電話に出れず、それを注意された時は本当に不快な気分になった。会社からの電話が非通知って何なの。本当、色々とツッコミどころがありすぎて呆れてしまう。配達員ありきのUber Eatsじゃないの？配達員を大事にしないこの状況じゃ今すぐ廃れるよ
2021-09-14 21:29:42,1,対応がとても遅い
2021-09-14 02:06:48,2,不具合や理不尽がそこそこある。 【アプリ】 週毎の売上が見れない。 2週間配達してないのに今更低評価される。 雨のミッションは無くなったのか？ 【客】 客の住所入力がめちゃくちゃ過ぎて ピンのあるところに行っても大体ズレてる。 マンション名は強制入力にして欲しい。 (部屋番号の入力間違えるやつもいた) 商品が破損しているのは配達員のせいではないぞ。 【店】 到着しても商品は出来ていない。 聞こえているのかなんなのか無反応な店員。 すぐに外れる寿司の蓋。 汁物はせめてラップして欲しい。 バッグの大きさをシカトしたクソデカパッケージのヤンニョムチキン。 配達員に負担がかかり過ぎている。 その割に1回300～400円なら出前館の方が良いね
2021-09-13 17:09:34,1,コンプライアンス大丈夫？ オンラインの場合、スリーブモードにしてもリクエストが落ちてくると勝手に画面起動して操作可能になっている(Uberアプリのみ) つまり、テーブルの上に置いて席を外した場合は第三者に操作されてしまう可能性があり表示される個人情報が漏れる可能性があります。 スマホのフリープモードってなんの為にあるのでしょうか？ それを無視したUberアプリの仕様は個人情報漏洩も無視した仕様だと思います。
2021-09-12 21:00:01,1,ほんとわりとくそ！w
2021-09-12 11:27:48,4,夜中もプロモーションアップしてほしいです。
2021-09-11 16:57:31,1,最低賃金わるのでやめた方がいいです。
2021-09-10 14:53:32,4,他社の配達アプリと比較すると 間違いなく一番クオリティーが高い。
2021-09-08 09:06:24,1,苦節半年。やっと登録出来ました。50回くらい申請審査出して、通らなかったのに、突然通った。とかく分かりづらい。
2021-09-06 07:17:50,5,週ごとの売り上げの表示がエラーで見れなくなってるので対応してください。何回目ですかこれ
2021-09-05 20:52:17,1,アプリで日別の実績が見れなくなったのが不便。 バグなら早く直してくれ
2021-09-05 01:32:39,1,過去の売上が見れないバグを修正してください
2021-09-04 22:19:21,1,サポート最低。問題放置にもほどがある。日本語がまともに通じません。
2021-09-04 19:44:35,1,インターフェース使いづらすぎ問題
2021-09-04 17:50:32,4,すごい運動しながらできるのはうれしいです。 ただなおしてほしいところは もっとクエストを簡単にして欲しい 毎日例えば1回配達で250円+とかそういう簡単なクエストにして欲しい 誰もが空いてる時間にできるものとして成り立ってると思うのでそこは曲げずにやってほしい。 そこを改善すればもっと楽しめるし頑張れる！
2021-09-04 10:27:24,2,サポセンに連絡メールで取るのがめんどくさい。 メールの返信遅い。
2021-09-03 20:31:39,1,ピンずれがひどい。
2021-09-03 20:07:38,1,あの、毎回、銀行口座の、番号❓突然消えて、ないと言われて乗車できなのは、何故ですか❓
2021-09-02 19:46:52,1,クソアプリ
2021-09-02 19:27:41,1,ここ数日ネットワークエラーで開けませんと言われ何日経っても開けなくなった
2021-09-02 18:29:39,1,何するにしても、遅い。電話しても出ない。アパートの記載場所ずれてる、サポートに電話予約しかできないけど、それすらできない。なんなの
2021-09-02 11:39:04,1,ダサい
2021-09-01 23:31:24,3,評価システムがイマイチ。
2021-09-01 21:14:00,1,更新後に週ごとの売り上げが見れなくなりました、これまでもちょくちょく起きている現象です。どうして同じ現象が繰り返して発生するのですか？
2021-09-01 11:47:31,1,バグは他の方が言ってるように多い。また、配達先が分からず、お客様に電話をかける際、相手側になんと着信表示されているのか知りませんが、出てもらえないことが多い。数回目で出てもらえたが、何度も掛けてきて何なんだと怒られる理不尽。挙げ句、低評価。一度、米国から電話があり、後で調べるとウーバーだったのだが、お客様にも同じ感じなのだろうか？ そもそも、配達先住所の情報を詳しく書いて貰えるようにして欲しい。住人は慣れていても配達員にとっては分かりにくい入り口などの注意書きがされるかは、言ってはなんだがお客様の質に左右され、当たり外れがある。
2021-09-01 07:17:13,1,更新したらいつもトラブル
2021-08-31 19:28:22,1,すぐバグるしごみ
2021-08-31 10:40:34,1,更新のたびに売上明細が見られなくなる 顧客への電話も時々繋がらなくなる
2021-08-31 00:42:10,1,アプリやシステムに不具合多発。さらにサポートとの連絡手段がない。どうしろと？
2021-08-28 18:42:34,1,登録してもすごい時間がかかる何度も同じ登録をさせられる
2021-08-27 17:22:59,1,いつになったら売り上げ見れるように改善されんの？ 早く直せよ。
2021-08-27 01:42:29,2,私もやっていまが注文者の頼み方が不慣れらしくマンション名入って無いとか、様々ありすぎなのでもうちょい使いやすくして欲しいです、
2021-08-26 09:17:49,1,住所が違う事が相当数ある。 また長距離で低単価が多すぎる。 アプリもわざと配達先を出さないようにしているので、悪質。
2021-08-26 09:00:03,1,"今日の朝から,店,移動距離,金額表示がされなくなりました。相変わらずサポートの電話は謎の待ちアナウンスの繰り返し,チャットで問い合わせると,アプリのアンインストール,インストール,スマートフォンの再起動,電源ON,OFFしてください と言われ,一方的にチャット終了されました。とても不親切です。たまに表示されたかと思ったら,金額表示が謎の1961円と距離表示も15??kmと,バグのような表示が…。とにかく,普通に配達したいだけなので,早く改善してほしいです。"
2021-08-25 13:39:38,1,まずエラーで売り上げ情報が確認出来ない。 1km(10分未満)で544円の配達報酬に対して、5.7km(35分)の配達報酬355円という事実に納得がいくよう説明を宜しくお願いします。(確認しましたが、雨、ブースト等は出てませんでした。) 配達完了間際に別の依頼を送るの止めてください。断れば受注率が下がり依頼が入ってこなくなるし、画面が固定されるので無視して配達先のマンションをマップで確認する事が出来ません。非常に困ります。何より、楽しみに待ってくださっているお客様をこけにしている事に気が付いておりますか？改善宜しくお願いします。
2021-08-24 17:59:52,1,更新出来ない
2021-08-24 15:52:54,1,簡単に顔写真を変更出来ないので、プライバシーの問題としてどうなのか？また、サポートに問い合わせても簡単に出来ない。
2021-08-24 09:24:33,1,動作しない
2021-08-23 14:23:15,1,バグが多い
2021-08-23 10:55:18,1,友達紹介をタップしても反応がないため紹介出来ません。
2021-08-23 04:50:37,1,私も最近売上画面が正しく表示されなくなりました。このトラブルが私だけでなくて安心しましたが、相変わらずチャットのサポート問い合わせ先がわからなくてヘルプがほとんど機能していません。なぜサポートへのチャット問い合わせ先をわかりやすく表示していないのか理解に苦しみます。サポートしたくないんですか？ 仕事は楽しいのですが、いつもアプリが原因でイライラさせられます。
2021-08-21 21:59:11,5,最高。
2021-08-21 18:37:52,1,いつでも配達を始められます。とメールが届いたのに出発ボタンをタップしてもオンラインになりません。
2021-08-21 16:13:22,3,まだまだ使い難いです。
2021-08-21 15:53:59,3,急に現金払い可能に勝手になる、
2021-08-21 15:25:18,1,いい加減な住所しか書いてない注文者は注文できなくしろ(｀Δ´) 問い合わせること前提で注文してくんな(｀Δ´)
2021-08-21 12:45:34,4,配達先へお伝えするために、配送元が同時に配達先画面に出ると、親切なお伝えができます。
2021-08-21 10:55:56,1,ピーク中に更新させるなよ、バカか？
2021-08-21 09:44:33,3,少しわかりづらいです
2021-08-21 00:01:52,1,ウォレットを選択し、クレカからマイナス分を支払ったのに正しく反映されてません😭 あまりにもショックだったので明日はピザの食べ放題に行ってきます😋
2021-08-19 23:58:24,1,はよ不具合直せや
2021-08-19 13:26:34,2,ここ一ヶ月程、売上履歴が確認できません。 メンテナンス等があるならお知らせ頂きたいです…(ToT)
2021-08-17 23:21:03,1,売上確認が出来ません このままでは確定申告に影響が出てしまいます 早急な対応をお願い致します
2021-08-17 19:19:02,1,キャッシュカードの認証が延々に通らないし、チャットしても返答が遅いし解決にならない。そのせいで、配達料金が振り込まれない。
2021-08-17 16:10:10,1,過去の売上が見れないと確定申告の登録で困る。早急に対応してほしい。あと配達員から直通で電話連絡できなくしたのも改悪。 とにかく日に日に改悪改悪で報酬は減る一方。運営さんは儲かって儲かって仕方ないですね。 配達パートナーという表現はいい加減やめて「奴隷募集」と書かれてはどうですか？
2021-08-17 09:24:34,1,8月から色々とアプリ不具合「過去の売り上げが見れなくな り、「詳細を見る」や｢グラフ｣、 ｢今後のプロモ ーション｣、「知り合いを紹介」する等もタップ しても開かない。 ⇨サポートへ問い合わせしたら…ブラウザからアクセスするように言われ…」。 ここ最近は「このデータの読み込み中にエラーが発生しました。サーバーに問題が生じている可能性があります。しばらくしてから再度お試しください。」出てアインストールしても改善無し。 iosはどうなんだろう？自分はAndroidなので…
2021-08-16 22:58:57,1,どんどん悪化して行く 売上情報の画面。 サポートから、 再インストール、電源再起動 何回やっても変わらん。 挙げ句、サーバーエラーで 表示出来ず、しばらくしてから ご確認ください。 三ヶ日。
2021-08-16 22:38:36,2,過去売り上げ見れません。早急に改善求めます！確定申告の時に、非常に困ります！
2021-08-16 12:03:04,1,ホントにクソですねー、いきなり銀行口座の登録をしてくださいってきて(既に2回ぐらい支払いがあった)登録したんだけどって再度カード登録したのに本人確認がとれないので支払いが来週になってしまいました。本人確認用に免許証や通帳を写真撮って送ったのに画像すらみてないのか？真面目に働けよな
2021-08-16 10:26:51,1,売り上げ詳細が見れない！8月入ってから週間の売り上げすらサーバーのエラーメッセージになり見れない！アプリを利用する度に、凄いストレス！又クエストの件数に誤差あり！不完全過ぎる！ ストレスフリーな仕事にストレス与えるとかありえない(笑)
2021-08-14 21:50:51,1,売り上げ情報が全く見れない。
2021-08-14 19:03:48,1,Uberwalletの表示がされないです、サポートセンターに問い合わせしようとしましたが、音声ガイドのみなので解決しませんでした、できれば対応のほどよろしくお願い致します。
2021-08-14 11:30:45,1,売上の確認画面がおかしくないですか？ 他にもタップしても反応しない事が多すぎる。 あとは、受ける気のない配達を誤タップで受けさせる為の受付時間短縮化ですか？
2021-08-13 19:33:42,1,顧客対応がくそすぎる 返事遅いしいくら待っても全く解決してくれない
2021-08-13 12:21:21,1,日増しに不具合も増えていくばかりで配達に支障もあり困ります。
2021-08-13 09:01:26,3,受付番号のゼロとアルファベットのＯの違い誰もわからない?不思議?
2021-08-13 05:47:36,1,Uberの中で配達に登録している人たちのデータが紛失とかしたのかな？ 支払いしたのに未払いと言われまた支払いさせようとされている。 口座情報も新たに登録させようとしているしアプデの時になどにデータが飛んだ？ サポートに連絡しても対応ないし不信感だらけだ
2021-08-13 00:22:36,2,他のアプリ起動時に入った注文はドロップとピックアップ箇所が出ない
2021-08-13 00:04:36,4,サポートセンターの、対応以外は、有り
2021-08-12 15:45:04,4,運営には困っていないんですが、 管理画面の不具合に困っています。 知り合い紹介のプロモーションを使いたいんですが、タップ出来ません。 機会損失です。サポートセンターを充実させて欲しい。ここの評価コメントで、恐らくサーバーダウンかと合点がいきました。早急に復旧してください。
2021-08-11 13:50:27,1,バグが相変わらず...
2021-08-11 00:21:47,1,メニューの売り上げの欄にて招待コードが見れるとヘルプに書いてあったがタップしても反応すらしない まるでそんな欄等存在しないようにだ バグなのかなんなのかしらんが早急に対策しろ
2021-08-10 22:13:32,3,売り上げ額の欄で、詳細を見るのカーソルを押した際に押しても見ることが出来なくなっているので改善してほしいです。
2021-08-10 21:24:45,1,売上状況の詳細が見れなくなっています。 報酬額も確認できないし、頂いたチップがどなたからなのかも分からずモチベーションが上がりません。 早急な対応を求めます。
2021-08-10 09:59:50,3,8月になってからアプリ内で売上が確認できないって言ってる方、ブラウザからログインすれば見れますよ。
2021-08-10 08:04:47,2,先週まで振り込みの日に銀行口座にちゃんと報酬入ってたのですがなぜか今まで使えてた口座が急に使えなくなっていつの間にか報酬が来週分に回されてました…危うくクレジットカードの支払いができなくなるところでした… サポートのチャットも機能していないみたいなので至急改善よろしくお願いします。
2021-08-09 20:07:32,1,マンション名が表示されないことが多い。 何とかしてほしい。 売り上げ詳細が表示されない。 2件12kmで、報酬が400円台なんてありえない。ブースト1.3で300円?詐欺まがい笑
2021-08-09 11:27:47,1,ダメ
2021-08-09 04:41:35,1,前回のアップデート以降売り上げ金額の詳細をタップしても見れなくなってしった。売り上げ金額を確認するのにとても不便なので早急に改善、対応お願いします。
2021-08-08 14:04:08,1,売上げ情報が見れません。どういう事？毎月計算しているので直ぐ対象してください。
2021-08-08 08:59:00,3,オンラインに出来ないアカウントの確認が必要と表示されてしまう
2021-08-07 22:30:35,5,ピンが全然違うところを指します？
2021-08-07 07:00:59,5,とても使いやすいアプリです。
2021-08-07 05:31:12,2,■最近は深夜の報酬が安過ぎて何度も拒否をしている。注文者もお店側も困るから、飲食店やタクシー同様に22時以降の配達は深夜料金を加算すべきだと思う。サービスに対する対価は受け取る者がちゃんと払うべき。　 ■あと僻地やエリアの端っこや半島の先端地、出入りが面倒くさいし時間を取られるタワマンが届け先の場合の自動的な加算設定もして欲しい。もしくは、チップの事前表示で配達後に増額は出来ても減額は不可能な仕組み。これらが備われば、現状より改善されると思う。そういう場所は単に行きたくないのではなく、割に合わないから行かないだけなのです。　 ■GoogleMap以外を使いたい時もあるので住所をコピー出来る様にして欲しい。　
2021-08-06 11:49:47,1,イラつかせる
