,date,title,rate,comment
1056,2020-10-26,どこよりも安かった,3.75,良い点　急遽、持っていく荷物を変更追加したのですが快く引き受けてくださいました。丁寧な対応でした。悪い点　作業途中、こちらのミスで作業員さんを不機嫌にさせてしまい、残念な気持ちになりました。最後はきちんと対応していただいたので良かったのですが。
1036,2020-10-26,スピード感がある,3.75,金額は現在の相場での価格では、とてもお値打ちにしてくれた。対応営業は、新人であったがきちんと話を聞いてくれて要望を叶えてくれる様に頑張ってくれた印象を受けた。作業者も当初の人数より多く応援に来てくれて、早い対応で荷造りが出来てなかった所を手伝ってくれたので、とても助かった。しかし、物の扱い方が雑で置き場所も記入していたが違う所に置いてあったりした。他社に頼んだ際に冷蔵庫の上や引越しで分かる汚れの所を掃除してくれるというサービスがあったが、今回はサービスはなく汚れたままであった。当初の説明では、他社と同様にサービスするという事を言っていたのに…と残念でした。運んでもらっている時は、スピード感があるので圧倒されますが、落ち着いて運んでもらう場所、運んでもらった部屋を確認されるといいと思います。
1026,2020-10-27,利用はなかったが、知名度はあった,3.0,訪問見積もり時の対応は良く、営業対応は問題なかった。悪かった点として作業員の作業態度、ベッドの部品紛失、(後日部品の代替品を購入し取付に来たが、日時調整を再度しなければならず、億劫であった)、ベットの板部分の塗装がはがれるなど、引っ越し自体については作業の質として、大きく疑問が残った。安かろう悪かろうなのか、たまたま実際の引越の作業人の運なのか、自分が実際にあたってみないとわからないものである。
1041,2020-10-27,しつこいテレアポもなく、メール連絡もよく好印象,4.75,相見積を取る為に営業さんに来てもらいましたが、全国展開の会社にも関わらず、地元の安い業者とほぼ同価格を提示されたので即決しました。無駄な電話連絡もなく、メールの返信もスピーディで文面も好印象でした。作業員の方の接客対応もバツグンでとても早く作業が終わりました。知り合いからの勧めもあり選びましたがまた引越しする機会があったらぜひ利用したい信頼出来る引越し屋さんでした。
1055,2020-10-27,時間通りで、素早く作業をしていた。,4.0,タンスを2階へ運ぶときに、新人さんの不慣れで、新築戸建のかべを2箇所剥がされてしまった。これが残念かな。
1053,2020-10-28,とても対応が早く信頼できると思いました！,5.0,良かった点は、対応の早さと他社さんの見積もりより金額が半額ぐらいになった事です。荷物が少ない事を伝えて、電話だけで見積もりをしていただき追加料金もなくとても満足しています。悪い点はほとんどなかったのですが、強いて言うなら引っ越し日の時間帯だけ希望の時間が受付の方に伝わっていなく希望と全く違う時間帯を提案されてしまったことです。でも最終的に希望通りの時間に届けてくれたのでそこまで悪い印象にはなりませんでした。
1054,2020-10-28,有名な企業様。,4.25,電話受付の方の対応が非常によかった。しかし電話対応の際良い対応すぎて、相対的に作業時の対応が少し悪く感じてしまった。
1052,2020-10-28,電話対応も作業も非常に丁寧で非常に満足しています。,5.0,電話対応が非常によく、良い印象を受けた上に数社比較した結果一番低価格だったので、ハート引越センターに依頼しました。約束通り、電話にて訪問日の時間連絡も来て非常に助かりました。県外にいる子どもが引越する場合は是非ハート引越センターを紹介しようと考えています。
1051,2020-10-28,キビキビと作業をこなし、すぐ終わった！,5.0,受付時の女性の対応が非常に良かった！引越し日が急に決まり、何とか出来ないかと気を揉んだ所、親身に話を聞いてくれ、希望に沿うかたちで対応してくれた！他の2社は門前払い状態で、日程は合わなかった！
1028,2020-10-28,良心的な感じでよかった,4.0,特に問題はなかったですが　支払いの都合上到着先で支払いしたかったのですが　どうしても出発先でということで振り込みになりました。手数料も掛かることですし、どうにか出来なかったのかなと思いました。
1050,2020-10-29,早くて丁寧でした,5.0,息子が大阪で大学生生活をしていたのですが、後期授業もリモート授業であとは卒論だけだったので広島の実家に引き上げる為、引っ越しをしました。今、コロナもあり引っ越しの手伝いに行くことも出来なかったので荷物の梱包もしていただけて、安くしていただける引っ越し屋さんをと思い三社から見積もりを出していただいて総合的に考えてハート引っ越しセンターに決めました。荷造りには女性スタッフさんがテキパキと丁寧に箱詰めをしてくれ、荷物出しは男性スタッフさんがあっという間に運び出してくださいました。地元への荷入れは単身引っ越しなので荷物がまとまってからの荷入れにした方が安くなるので日にち指定はできませんが後日の配達となりました。我が家にとってはその方がベストでした。日程が決まったら早めに連絡もいただけるので、前もって仕事の調整をすることもできました。息子から、とにかく仕事が早いとは聞いていましたが、ほんとに荷入れもテキパキと仕事が早くて驚きました。スタッフの方も感じが良く、とても満足いく引っ越しができました。また、春からの新生活が始まるときにはハート引っ越しセンターさんにお願いしたいと思っています。
1044,2020-10-29,スピーディーな印象,4.25,初期の段階では自分の引越し先、日程が決まっておらず不明確な部分あったのですが、見積もりや日程どりをしていただけた。また他社の値段をからさらに下げた値段で対応いただけたので、非常にありがたかったです。他社では引っ越しの日程や引越し先が確定していないと見積もりはできないと断られることがあったため、未確定で見積もりしていただけたのは助かりました。値段が他社の見積り額に比べ非常に安いため、実際の作業はどうなんだろう？という不安がありました。ただ、作業自体は荷物の搬出、搬入ともにスピーディーでした。また、荷物の梱包も丁寧にしていただき、引っ越しで運んだ荷物が壊れる等の問題は発生しませんでした。値段は他の引っ越し会社と比べると非常に安く、引っ越し作業自体も丁寧でスピーディーでしたので、周囲の人に勧められる会社だなと感じました。
1049,2020-10-29,引越し業者自体はよかった,1.0,それなりの料金を支払ったので運搬や設置に関する融通を聞いてくださって助かりました。が、しかし、洗濯機取り付けの技術担当が電話しないとこない。電話したら「何度も電話したんですが、前のお客様で遅れてしまって～」といわれ、電話も1回しかきてない。15分で着くと言われて、用事があるのにまってたのにこない。最悪でした。引越し業者がよかっただけに残念でもう頼みません。受付の電話や、見積もりに来てくださった方の対応はこちらの要望にきちんと答えてくれようと非常に丁寧でした。
1025,2020-10-29,とても良かった,4.0,大変良かった電話での概算見積もり対応である程度の金額を出してもらえて安心して訪問見積もりをして貰えて良かった
1030,2020-10-29,仕事が丁寧で愛想がよく安い,4.25,【見積もり時の対応】メールと電話両方で対応していただいたので非常に便利で、電話口の態度も良かった。【料金】他社と比べて段違いに安く、金がある方ではないので助かった。【作業内容】手早く行ってくれて好印象だった。【全体的な評価】細かい点で気になることがあるものの、概ね良かった。上の下くらい。【良かった点】料金が安く、それにしては対応もスタッフの態度も良い点。【気になった点】電話が繋がらないときがあった。段ボールを５箱用意すると言っていたが、事業所と作業員で連絡の行き違いがあり、用意されていなかった。
1042,2020-10-30,初めての利用でしたが、全ての対応が丁寧でした。,5.0,２人での作業でしたが、無駄がなく、テキパキと丁寧に対応していただきました。電話、見積もりの方の説明も分かりやすかったです。
1040,2020-10-30,コスパがよい,3.5,"訪問見積で3社にきてもらいました。最初の業者さんの見積では約50,000円でしたが、値引き交渉を行い、最終的にハート引越センターさんで38,500円との見積を出していただき、こちらに決めました。立ち寄りでの引越しでしたが、立ち寄り先にも段ボールやガムテープ、陶器を包む紙や布団袋を送っていただき、助かりました。"
1048,2020-10-30,丁寧で良かったと思います。,3.25,大人数来て頂くのは、いいのですが…主に、テキパキ動いていたのは、２、3人位かなぁ…と思うのですが…前の引っ越し業者さんも、7〜8人で作業されてましたが、半分の方はあまり顔を見なかったような気がします。素人が、勝手な事言ってすみません。
1045,2020-10-31,知名度もある会社なので安心でした。,4.25,当初、不動産の紹介で2社見積をしたのですが夫婦２人暮らしで2社とも9万円でした。思っていたより高く、以前から気になっていたネットで探すことにしました。最初は数社からメールが来てびっくり。そのうちのハート引越センターは、他社と比べて同じサービスで安い料金だったので見積依頼をしました。営業マンが実際に見積をしてくれたのですが、料金交渉にも応じてくれてネット割引特典も受けれあかげで約6万円。断然安い‼️ネットで引越しを頼むのは正直不安でしたが、営業マンのしっかりした対応で安心して依頼することにしました。引越日は、時間指定なしの方が安かったので12時から16時の幅で予約でしたが、当日の朝に12時過ぎとの連絡をいただきました。作業は3人で、息ピッタリ無駄のない動きや対応に、日頃教育を受けているんだなおと感心しました。3人の連携作業は、見ていて気持ち良かったです。本当に頼んで正解。ネットは安くて対応が早い。自分に合った会社を選べるのもいいですね。大満足な引越日でした。ハート引越センターさん、ありがとうございました。
1047,2020-10-31,丁寧で対応がとても良かったと思います。,4.75,同じ集合住宅に住んでいる方が引越してきた際にハート引越センターを使っており、偶然居合わせところ、従業員の方の対応や印象が良かったので、自分たちが引越す際は同じところに頼みたいなと思っていました。今回の引越しにあたり、複数の会社から見積依頼をしてみたところ、他社の方の印象も良かったのですが、やはり頼みたかった会社の訪問見積を受けてみたら誠実で丁寧な対応をして頂いたのでその場でお願いすることとしました。また金額面についても、当初より大幅に頑張ってくれたのでそこも決め手だったと思っています。当日、来た従業員の方も丁寧で、都度声掛けや確認をしながら運搬してくれたのでとても満足しています。ダンボールも後日無料で引き取りをしてくれるので荷解きが完了したら頼んでみたいと思います。
1000,2020-11-02,契約通りに作業してくれて良かった。,4.5,時間通りに来ていただいて、時間のロスが無く良かったです。ベッドの書いた、組み立ても無料でやって頂き良かったです。
1037,2020-11-02,早い,4.75,朝一から来ていただいたのでその後の予定などがきっちりこなす事ができました。荷物が少なかった事もありますがテキパキスピーディに仕事してくれました。
1038,2020-11-02,スタッフがとても礼儀正しく素晴らしかった。,4.75,良かった点は、スタッフの礼儀正しい対応と引越し作業の手際がすごく良かった。さらに作業が丁寧だった。悪い点は見当たらなかった。もう引越しはしばらく無いと思うが、もし次回の引越しがあるならばハート引越しセンターさんに依頼すると思う。
1022,2020-11-02,とても笑顔が素敵で効率よく作業をしてくれました。,4.75,まずは東京から大阪への引っ越しでとても対応がよく作業も丁寧でテキパキとしてくださりました。大阪へ引っ越してからまたすぐに同じ府内での引っ越しが決まり見積りをしました。電話での見積り対応をして頂きその金額を「ハート引っ越し」に伝えるとこそから3千円も値引きしてくださりました。対応がいいのは前回でお墨付き！！値引きもしてもらい即決しました。本当に助かりました。ありがとうございます。私は転勤がかなり多く（年に平均3回程）お願いするなら「ハート引っ越し」って決めました。当然他社さんとの値段の交渉はさせてもらってからですが絶対に、安くして頂ける（一応他社さんの見積り金額をお伝えはさせて頂きます。）！間違いなく丁寧である！言葉使いもとても感じがいい！よく教育されている！って絶対的な確信があるからです。今後ともよろしくお願いいたします。
1018,2020-11-02,少ない荷物にも関わらず気持ちのいい対応でした。,5.0,良かった点は見積もり依頼メールの時に安い金額を提示してくれたので、最初の段階で候補になり、電話対応もスムーズに見積もりしていただき安い金額で、引越し出来た事。3人体制で来てくれたので、早く終わりました。悪かった点は特にないです。
1024,2020-11-03,手際よく作業ができた。安心して見ていられた,5.0,冷蔵庫の吊り上げ作業は、他の業者はネットや電話で出来ると言って下見しても結局できなかった。ハートは一回出来ないと回答したあと、出来るプランを探して提案してくれた。
1034,2020-11-04,手早く　丁寧,4.25,他の業者も　ほぼ倍～倍以上の値段だったので　「ハート引越し」さんに　お願いすることに決めた店舗へ　段ボールを取りにいったのだが　その対応も　とても感じが良かった当日は　こちらの希望をいうと　手早くあっという間に梱包してくれた　無駄な動きがなく　さすが「プロ」だなぁと　感心したコメントを書いてる時点では　荷物は　送り先にまだ届いてないのだが　傷まず届いていたら　また利用したいし　知り合いにもすすめたいと思う
1027,2020-11-04,電話での印象はよかったです。,5.0,営業の方、作業をしていただいた方どちらも丁寧で親切でした。料金見積もりも早く、当日の作業もテキパキとしていただきました。料金も良心的で助かりました。また引越し際はぜひ利用させていただきたいです。　以上の点から大変おすすめしたい業者さんです。
1035,2020-11-04,馴染みのない会社であったが、親切丁寧で良かった。,5.0,親切丁寧で、引越し作業もスピーディーで大変良かった。料金も安く、また機会があれば利用したい。引越し当日、予定のない小物の追加も受け付けてくれた為大変助かった。
996,2020-11-05,何処よりも安く、丁寧。,5.0,電話対応が、とても丁寧でした。見積もりも直ぐに出して下さった。何処よりも安かった!作業も丁寧でした。
1012,2020-11-05,クチコミ通りとても感じが良かった,5.0,電話対応の担当者、見積もり訪問の担当者、引っ越し当日のスタッフの方全員がとても感じが良かったです。説明を丁寧にしてくださり、こちらが気づかないことも事前に教えてくださったので本当に助かりました。また引っ越す機会があったらぜひ同じ会社を利用したいと思います。
1032,2020-11-06,まぁまぁという感じでした。,3.5,良かった点料金が安く抑えられた。悪かった点チーフの愛想が悪かった。営業さんとの話が通じていない感じがした。
1031,2020-11-06,すごく慎重で丁寧に作業して下さった。,3.75,作業自体が大変なのに、お客様を気遣う言葉を掛けて下さり嬉しかったです。引越費用を支払っているのに、こちらも手伝いたくなる気分になりました。コンテナの作業があったのですが、手違いがありコンテナ作業だけ別の時間帯になり引越作業が1日2回になり、近所に引越だったのでさほど負担にはなりませんでしたが少し残念でした。
1029,2020-11-06,作業スピードは早かった,3.5,作業スピードはとても早いものの、一方で当初の見積時とは異なる車両数、作業人数で訪問されたため、家の中の密が気になった。事前に断りを入れて欲しかった。また、荷物の取り扱いが作業員によっては雑だったりと、質に関して疑問を感じた。
1033,2020-11-06,作業が丁寧,4.0,訪問見積りの時に丁寧に説明をしてくれて安心して任せられる感じがあり値引きサービスをしてくれたので即決しました。
1015,2020-11-08,テキパキと動いていただいて助かりました。,4.75,洗濯機の別取付の料金が最初の見積りに含まれていなかったのが少し残念でした。しかし、それ以外は自分が思ったより低料金でしていただき感謝しています。
1023,2020-11-08,丁寧で臨機応変に対応して頂き、また、迅速で良かった,5.0,訪問に来て頂いた時もわかり易く説明して頂きまして、安心出来ました。見積もり内容も納得出来た。家電の処分も助かった。エアコン設置も下見に来て頂いて、安心した。引越しの機会があれば、またハート引越センターさんにお願いしたいです。悪かった点は、無いです。
1021,2020-11-09,コスパが高い,4.0,料金がとても安く、当初不安だったが、しっかりとした仕事で、非常にコスパが良かった。ただし、作業員がマスクをしていなかったのは、マイナス点でした。それ以外は非常に満足でした。
1013,2020-11-09,とても良い,5.0,直前に増えた荷物にも嫌な顔せず対応していただき感謝しています。積み下ろしの際にも片付けやすく置いてもらい大変満足しています。
1020,2020-11-09,ある一人のオペレーター以外はパーフェクトっ！！,5.0,最初に電話をくれたのをきっかけにこちらにお願いする事に。値段は一番安い訳ではなかったが最初の印象が良かったので迷い無くこちらに。途中担当の方とは違うオペレーターと話した時は『やめようかな』と思った位対応酷く冷めましたが、この約1名のせいで止めるのは負けた気がしたので、引き続きお願いしました。結果『大満足』！！元気良くスピーディー、ほんとお願いして良かったです☆是非また機会が有りましたらお願いしたいと思います。ありがとうございました。。。。
1017,2020-11-09,丁寧なお仕事で良かったです。,3.75,段ボール引き取りがなかったことだけが不満でした。何度も引っ越しをしているわけではないのでどの引っ越し業者が良いのかはわかりかねます。
1014,2020-11-10,手際も応対も素晴らしくて大満足でした,5.0,何度も引越ししましたが、値段が高い印象で、今回は近くだし、急ぎの予定もなかったので、家族で運ぼうと思っていましたが、大きな家具や冷蔵庫だけでも運んで貰えたらと、ネット検索してたら何社から見積もりの連絡がきましたが、ハートさんは電話のみでの的確な見積もりで、他社さんから安すぎるのは何かとトラブルの元だと助言を受けましたが、当日の対応もよく、手際良くて、愛想も良くて、大大大満足です。早速、知り合いにも知らせました。
1011,2020-11-14,配送情報が整理されている印象があった。,5.0,配送情報が整理されていて、見積時点で配送日程を計画することができた。移動距離が長く、配送日程を要望したところ、満足することができた。配送作業では、合理的な動作でよく訓練されていて、適切な養生材が選定されていた。今回、大型家具の配送を依頼したが、配送要望（留置期間）を満足する見積価格としてコストパフォーマンスに優れていた。
1016,2020-11-15,電話対応から現場対応までよかったです。,5.0,スピーディーに対応して頂きとてもたすかりました。電話、現場対応ともに印象が良くスムーズに引っ越しを終えることが出来ました。有り難うございました。
1010,2020-11-16,電話対応が素晴らしくかった,4.25,電話対応は抜群に良く、コストパフォーマンスも満足しているが、見積もりの算出方法が不明確。作業員は無駄な話しや行動も無く速やかに作業してくれた。作業前に換気のチェクをしたり、作業員の体温などの健康表の提示などコロナ禍の予防対策を明確にしてくれたらうれしいかも。全体評価は満足だが、対応電話が多くあり、競争が苛烈な業界のようなので、多くを求めてしまいます。
1008,2020-11-16,テキパキと進めていただき好印象。,4.0,見積り時から、内容が変わりましたが、嫌な顔もせず当初見積りどおりの金額でやっていただきました。作業スピード、態度も文句無し。
1009,2020-11-17,人柄や手際もよく、安心して頼むことが出来ました。,5.0,思ったより金額が安く驚きました。人柄や手際が良かったので、また利用したいと思いました。悪い点はありませんでした。
1007,2020-11-17,対応も素早く親切でした。,4.25,さすが引っ越しのプロだけあって作業は思ってたよりも素早くあっという間に終わりました。もし機会があるならまた利用させて頂きたいです。金額も予算よりもだいぶ安くて大満足です。
1005,2020-11-17,希望への対応が柔軟だった,4.0,今回同居することとなり、引越し業者を探しましたが、他社との対応と比較しても、親身になって相談に乗って貰った上、柔軟な対応で、2人分の引越し費用を考えていましたが、まとめて貰えたことで、格段に費用を抑えることができ、自分たちに合ったプランを提供して貰えたことが良かったです。また、初めに提示された金額が最安値で、どこの会社よりも安く、電話対応も含め非常に印象が良かったです。しかし、その分期待感も高まっていた為か、荷物の管理に対しての作業員の対応は少しイマイチに感じてしまいました。それでも、作業員の方も笑顔で頑張ってくれていましたし、そこまで気になることもありませんでした。ダンボールの回収もしてもらえるとの事で、アフターサービスなどもあり、安心して任せつつ、値段を抑えたい方には特におすすめだと思います。
