,date,title,rate,comment
487,2021-07-20,テンポよく、スピーディー,4.0,電話見積もりでも無理な勧誘はなく、サクサクと進みました。契約後の梱包材に関する問い合わせについても担当者さんからすぐに折り返しのご連絡がもらえたのでとても助かりました。単身での引っ越しだったためか、当日は2名体制でしたが手慣れた感じですすみました。ただ、過去には同じ単身の引っ越しで3名で来てくれる引っ越し業者もいるので比較すると少々時間がかかった印象です。
485,2021-07-22,ユニホームはピンクなのに、きっちり。,3.75,ベテランの方が、テキパキ指示されてスマートにお仕事されてました。見積り担当の方も親切な対応をしてくださりお願いすることに決めました。あとは、荷受のスタッフさんがどんなお仕事をしてくださるか、楽しみです。
484,2021-07-22,良くもなく悪くもないといった印象でした,4.75,まずは時間指定なしのフリープランであるものの驚きの安さで、16500円～です。この時間でなければいけないというのがないのであればかなりおすすめします。見積もりに関しては、メールでおおよその金額を提示して、検討しやすかった。後に、電話で詳しくどういったものか確認したり、追加はないかなど電話対応も好感が持てました。次にまた引っ越しする機会があれば、まず連絡を入れたい会社だと思いました。
471,2021-07-22,親切で対応もとてもよかった,4.25,悪かった点:電話が少し繋がりにくいなと思いましたその他は悪い点見つかりません。良かった点:電話越しの対応◎作業員の方もテキパキし印象もとてもよかったです。ダンボールの配達もこちらの都合に合わせてくださったりととても親切な会社だと思いました。到着前の電話も15分前くらいにしてくださったのでこちら動きやすかったです。処分するダンボールの回収(ハートさん以外のダンボールも回収してくれる)も来てくださるので、後片付けもとても楽になりました。旧家も引越し先も4階まで階段で狭く運びにくかったと思いますが、本当に助かりました、ありがとうございました！
477,2021-07-22,非常によかったです,3.75,相場よりも安くしてもらえよかったです。また、作業員の方の対応も素晴らしく色々と融通も聞いてもらえました。
468,2021-07-23,要望にそうようがんばっていてくれた,4.0,金額面でも上回ったけれど、なるべく希望金額に近ずけるよう努力してくれました。荷物も手際良く運んで頂いて満足出来る引越しとなりました。ありがとうございました！
483,2021-07-23,コスパの良い引越し会社さん,3.25,一括見積もりだとどうしても最初のきっかけ欲しさにあり得ないほど安い金額を提示してくる業者はいくらでもありますが、それほど金額の開きも無く価格も安かったのでこちらで契約しました。作業員の方は当初ぶっきらぼうな印象を受けましたが、仕事内容は丁寧で素早く大変満足しております。
479,2021-07-23,丁寧に作業をして下さいました。,3.5,丁寧に臨機応変にご対応いただき、満足です。ただ、3名来られた内2名の方が新人さんだったらしく、おぼつかない感じで家具を運ばれている様子に不安を覚えました。実際に、家具を床に落としてしまい、角の塗装が剥がれてしまいました。又、暑い中での作業だったので仕方がないのですが、大量の汗を拭わずに作業を続けられていた為、新品の畳にボタボタと汗を落とされたのは嫌でした。又、先輩社員さんが新人さんに注意をされていたのですが、客前で、というのはあまり気持ちの良いものでは無かったです。あと、家の中をかかとでドスドスと足音を立てて歩かれるのは気になりました。気になる点ばかりになりましたが、全体的には好印象な会社さんでした。
482,2021-07-24,丁寧な対応でした。,4.25,他の業者と違い、インターネット回線の契約やウォーターサーバーの設置を勧めてくることはなく、純粋に値引き交渉に応じて下さりました。最初の見積もり対応をして下さったオペレーターの方の対応は丁寧でしたが、時間確定の連絡を下さったオペレーターの方の対応は冷たい感じがしたので、オペレーターさんによって対応は変わると思います。費用を抑えるために品数を絞って見積もり、レンジを対象としていましたが、当日来られた作業員の方リストにはなかったようで、「あれ?電子レンジは?」と尋ねると、「あっ大丈夫ですよ、一緒に持っていきますよ」と、費用に含まれているはずなのにその場でお願いして持っていってあげますよ!の空気になってしまったのが解せ無いです。。それ以外は丁寧に養生をしてくださり、ベッドの組立も丁寧にやっていただきました。ただ、ＴＶの接続をやっていただけなかったのが残念です。せめて、電源が付くのか確認は必要ではないかな?と思いました。
481,2021-07-24,丁寧、迅速。,5.0,自分が考えていた相場と違いましたが丁寧に説明してくれて納得しました。訪問見積もり粗品は頂いていないです。値引き交渉に応じてくれて助かりました、また丁寧な対応でした。ダンボールのプレゼントや引き取りサービスについての感想は今回は該当していないです。ネットや知人から聞いていた評判と、実際に自分で依頼してみての感想はスムーズで迅速で良かったです、また度々、コマーシャルで拝見していてコマーシャルも面白いので良かったです。今後、この業者で引越しを考えている人に対してのアドバイスは丁寧な説明、迅速な対応でしたので利用してみる価値はあると思いますよ。
441,2021-07-25,とにかく安く早く引っ越しが終えられて満足,4.75,とにかく早く安くを重視していたので希望以上の最安値の金額で見積もりをしていただけて良かった。単身での引っ越しで近場の為、この距離であれば手持ちで運ぼうと思い、見積もり時とは異なる家具が当日あったのですが、トラックに入りきる荷物全て運んで下さったのでとても助かりました。予定していた時間よりも早く引越し作業を終わらせることが出来ました。担当者の雰囲気も良く、安心して作業を任せることが出来たので次回も利用したいと思いました。ありがとうございました。
469,2021-07-25,雰囲気が良い,5.0,暑い中での引っ越しでしたが、一つ一つ丁寧に確認しながら作業してもらってとても良かったです。また荷物詰めが多少残っていたものも、手伝ってもらってスムーズに引っ越しができました。
476,2021-07-26,安かろう悪かろう,2.75,他よりお値段が安く、また遠距離の引越しだったこともあり、選べる業者も少なくここにしました。また家族が利用した事もあり選びました。最初出発時に時刻通り来てくれた方は本来なら2名のはずが一人だけ。その方は丁寧に迅速に対応してくださいました。しかし遅れて来た方は2時間近くの遅刻。当然お一人で引越し作業できる訳なく作業滞り、部屋の引き渡し業者の方もお待たせしてしまう結果に。そして荷物到着時の作業は非常に雑。割れ物と書いてある箱を何故か1番下に運び入れ、案の定コップは粉々に割れていました。そして棚も凹み、机も凹み、入れる際に部屋の壁にぶつけ、作業中はずっと笑いながら作業員同士でお喋り…。この値段でも寧ろ損失を考えると高いくらいです。もう頼みません。
450,2021-07-26,荷物個数をカウントしたり確認も多く丁寧でした,3.5,中3日空けて混載だとお安くしてくれました見積もりで伝えたつもりでしたが思ったより荷物が多かったようで申し訳なくなりました引越し先では予定より到着が遅かったですがスタッフが変わりキビキビとあっという間に搬入が終わり助かりましたトータルでは気持ちの良い引越し屋さんです
455,2021-07-26,訪問見積に来てくれた営業さんの対応が良かったです。,3.75,訪問見積り時にダンボールを受け取れたので、すぐに荷造りに取りかかれました。洗濯機の取付込みで安い料金ですみ助かりました。すぐ必要に印を付けていた荷物が一番下に置かれていたのが残念でした。　　手際よくあっと言う間に作業が終わり助かりました。
466,2021-07-26,テキパキと素早く作業してくれました。,4.0,素早くテキパキと作業して、印象も爽やかでよかったです。ただ、作業ご床に5〜10センチ程の引っ掻いた様なキズがあり、クレーム入れるか微妙に悩んでいます。搬出後、1週間から10日で引越し先に搬入される予定ですがまだ連絡が無いので未定。そちらが、終わった後もう一度アンケートしてもいいのかしら？
428,2021-07-26,引越時間の連絡が遅く、電話対応も非常に悪かった。,3.5,支店に電話してもなかなか出ず、出た職員の対応も悪かった。3日前に、引っ越し時間を連絡すると言っていたのに、営業時間内に連絡がなかった。このような杜撰な引っ越し業者さんは、私の経験上、初めてだった。引っ越しに来られた方々は、しっかり仕事をされましたが、間接部門の対応は、改めるべきです。
464,2021-07-27,人員不足,2.5,見積に来られた営業さんは非常に感じの良い方で、しつこいセールス電話も無かった為、決めました。当日は二人作業で、終始イライラされていて、こちらも訳ありの引っ越しだったのが更に重い空気になりました。
475,2021-07-27,対応が早く他社より安かった。,4.25,この度は大変お世話になりました。直前の申し込みでしたが、希望の土日対応が可能で、段ボールやハンガーラックなども利用でき、スムーズに引っ越しができました。
458,2021-07-27,段ボールが来るのが遅れたのはびっくりした,4.5,段ボールが来るのが遅れたのはびっくりしましたが、当日は４人で来てくれてとてもスピーディーでした。話し方も柔らかく、汚れもふきながら運んでくれてとても良かったです。
431,2021-07-27,仕事運びのテキパキに感心した,5.0,料金も満足でしたし作業員の対応、仕事の運びもとても満足でした　私1人で対応したのですが何も困ったことがなく　安心してお任せできました　不満は何もありませんでした電話の対応に出た方も大変感じが良く第一印象が他の所よりずば抜けていました
472,2021-07-27,とても、丁寧でした。,4.75,すごく安い金額でやってくれました。色々お金がかかるので、費用が、抑えられてありがたかったです。クローゼットや掛けてある洋服がそのまま運べたので、楽でした。ちゃんと置く場所なども一回一回聞いてくれたり、違う場所に置き直すのもやってくれました、とても、丁寧でした。後日ダンボール回収もしてくれるそうなので、たすかります。途中で、置く前に家具のそうじをしたいと言ったら、ちゃんと待って、あとまわしにしてくれたり、かべが傷つかないように、パネルのようなもので、保護もしてくれていました。2回運びでしたが、スピードは、かなり早かったとおもいます。引っ越しの費用ですが、7.8社比較しましたが、かなりの差でだんとつ安かったです。エアコン洗濯機の脱着も安くしてくれました。また、引っ越しがあったら、同じ所に頼みたいとおもいます。
474,2021-07-27,作業員の対応が非常によい,4.75,現金支払いを言われていたが、前払いということは知らなかった。また、依頼時点では、現金支払いしか受け付けないような話であったが、作業員の話では、クレジットでも可能とのことであった。ただ、見積もり、途中連絡、当日の作業内容に関しては申し分ない。
444,2021-07-28,対応はいい。,4.5,営業の方や作業員の対応はとても良かったが、荷物が潰れていたり衣装ケースが割れたりした。ダンボールにコワレモノと記入しても一番下に積まれたりした。
473,2021-07-28,電話対応も作業員さんもとても印象が良かった,5.0,前々日に何時に来るか連絡があり、当日も連絡がありとても安心感はあった。そして当日の作業員さんも3名でテキパキとても早く丁寧でした。もしまた引っ越すことがあったらお願いしたいと思った。冷蔵庫設置した時にグラつきがあったみたいでそれも最後までちゃんと設置してくれたのはとてもよかった。悪かった点としては、見積もり時の金額を想定してしまうと実際とだいぶ変わるので注意だと思った。
467,2021-07-29,感じが良かった,4.0,スピーディーに進めてくれて予定より早く終わりました。観葉植物が倒れてしまったのと、冷蔵庫がへこんでましたが、まあしょうがないかなって感じです。作業はとても早いので急いでいる方には良いと思います。
470,2021-07-29,元気がよく、印象がとてもよい。,5.0,訪問見積もりの時から頑張ります！と言って頂き、他者と値引き交渉を持ち掛けた際、更に頑張って頂き、とても安くでき、とても満足しています。
465,2021-07-30,すごく丁寧で経験値が豊富,5.0,電話対応が丁寧な上当日にさらに丁寧に荷物を準備していただき、余計な費用の請求もなく、アフターサポートもしっかりしていました。
462,2021-07-30,みなさん一所懸命,4.75,見積もりの電話対応も良く引っ越しも一所懸命スムーズに進めていただき気持ちよく終える事ができました。
460,2021-07-30,リーズナブルで丁寧な引越し会社。,4.5,■良かった点・営業マン2歳児1名を含む家族3人の引越し。（マンション→戸建）ネットで見積もりを取った際に約5万円という金額が出ており、安く引越しができるのではないかと思い訪問見積もりにお越しいただきました。先に見積を実施した他社では約20万円の見積書を提示され、どうしようと思っていた中でした。昨年営業実績NO1だったという方が訪問見積もりにお越しいただきました。説明はポイントを押さえており、必要費用の裏付けについても判りやすかったです（トラック台数　作業員人数、月末日付など　金額の決め手となるポイントについて明確に説明）。結局出てきた見積もりはこちらが考えていたよりも高い1４万円でしたが、予算を話して相談したところ、その場で大幅に値引きをいただき契約を決めました。我家は子供用品を含め特にモノが多かったのですがネットの見積もりだけでは分からない部分も多いようです。「ネットの場合は自分で入力した分しか運べないが、訪問見積もりでは営業マンが見て判断した分、すべて積み残しなく運ぶ」という説明が印象的でした。事前の見積の通り、2トン車2台でパンパンに荷物を詰めていただき引っ越しました。家財の多い家の場合はネット見積もりは参考程度に思っていた方が良いと思います。・実際の作業員当日はトラック2台で来てくれました。搬出はてきぱきとしていました。20代の若い作業員の方が中心でしたが、リーダーの方が全体を見ながらコントロールしてくれました。引越し先は新築でしたがしっかりと養生もしてくれ、荷物は丁寧に扱ってくれました。割れ物や電子機器なども多く運んでもらいましたが、特段不具合のあるものはありませんでした。時折冗談も交えながら従業員同士や我々とも会話しながら楽しい雰囲気での引越しとなりました。■悪かった点訪問見積もりにお越しいただくまで不便があった覚えがあります。（支店ごとの対応、メールでは依頼できない、訪問まで少々待たされるなど）他は特段はありません。他社では付帯サービスで清掃などができるサービスやプレゼントがあるということがありましたがそういったものはありません。（段ボールの引き取りはあります）引越しサービス単体そのもので見れば、リーズナブルな価格に対して十分満足のいく仕事をしてもらったと思っています。
429,2021-07-30,臨機応変に対応していただきました！,4.75,他の業者さんだとかかる段ボールやガムテープ代などが無料で、追加してもすぐに配達していただけて安心して梱包できました。段ボールの回収も有料の業者さんもあるなか無料で助かりました。5社の見積もりの中で1番安くてサービスが良かったです。梱包も丁寧にしてもらえてスタッフの方も皆さん感じが良くて安心して引っ越しできました。次回もまたお願いしたいと思います。
398,2021-07-30,テキパキと作業して下さり安心できた。,4.5,【良かった点】営業の方がとても丁寧で決裁者の方との電話のやり取りもオープンで気持ちが良かったです。合い見積もりを取るつもりで3件目の業者でした。合い見積もりを取っていることは話しませんでしたが最初から良心的な価格を提示して下さました。最初の業者は相場を知らなければ取れるかもというような金額でハートさんの倍の価格を提示してきました。【悪かった点】料金の支払い方法にもっと選択肢が欲しかったです。引越し作業も自分では荷造りでどうしてよいか分からないものもテキパキと梱包して下さいました。【感想】値引き交渉はこちら側にも日時の幅があるともっと値引いていただけたと思います。訪問見積もりの粗品はありませんでしたがない分価格が抑えられていたのではないかと思いました。もしまた引越しする時は是非、ハート引越センターを利用したいと思います。
449,2021-07-31,スタッフの皆さん感じが良かったです。,4.5,猛暑日の中迅速かつ丁寧に対応して下さり大変よかったです。最後書類にサインする時にマスクを外ずされていたのが残念です。大変暑い日でしたが、やはりコロナ禍なのでそこは重要だと思います。後は良かったです。ありがとうございました。
446,2021-07-31,非常に素晴らしいです。,5.0,オペレーターの方は迅速な対応でわかりやすく伝えてくれました。実際に来られた方も非常に対応がよく、また引っ越す際は御社を是非使いたいですし友人も紹介したいと思います
463,2021-07-31,迅速かつ丁寧,5.0,予約から見積作成迄が迅速であり、こちらの要望をしっかりを聞き、柔軟に対応してもらえた。また、値引き交渉にも快く応じて頂き、ダンボールのプレゼント等もしてくれた。引越当日は、予定より早く自宅に来ましたが、事前に確認の電話があり丁寧だった。作業も効率よく丁寧な仕事をしており、非常に好感が持てた。単身の引越だったためか、30分程で全ての作業が終わり、非常にスピーディーだった。
434,2021-08-01,真面目に責任を持って作業にあたってくれた,5.0,大物家電とベッドだけの少量の依頼にしっかり対応してくれたし、他と比べてすごく安かった。他ではこんなに安い見積もりは出なかったから迷わずに業者を決めることができた。ベッドの解体が通常通りできない（家具の不具合）事態が発生した時にも人を増員して対応してくれた。作業の方も親切に対応してもらったので安心感があった。エアコンの取外取付をお願いしたが当日、取外しと取付業者が別で時間のスケジュールを私が調整しないといけないことを知らず大変だった。（引っ越しの荷物が着いてないのに取付業者が先に来てしまった）でも業者さんも快く待っていてくれた。引越し後のトラブルにも電話をしたら迅速に対応してくれた。
432,2021-08-01,作業員の方は、とても感じが良かった。,4.0,良かった点は、見積もりの際に伝え忘れていたスタッドレスタイヤも運んでもらえたし、プランターも運んでもらえた悪かった点は、見積もりの際に、ベッドも1台無し、ダイニングテーブルセットも無し、タンスも2つなど、おおよその荷物の量を見てもらったのに、どの会社も4トントラックと言われたが、実際に引っ越しで使われたトラックの最大積載量は2850kgと書いてあった…このトラックのサイズの差が、どれくらい費用の差になるか分からないが、残念な点としてあげたい
457,2021-08-01,電話担当がコロコロ変わった,3.75,最初、見積もりが安かったのでお願いしましたが、最初なにもいわれてないのに、積み込めてない荷物は運ばないなど結構厳しめにいわれました。ですが、説明されていないことなどを伝えると追加ではありますが、対応をしてくれました。
461,2021-08-01,当日来てくださったスタッフは親切でした。,3.75,リノベーションに伴う荷物の移動でしたが、手際良く作業を進めて下さり、大変助かりました。高齢者が自宅のリフォーム等を行う場合、自分たちでは大きなものの移動は困難です。そうしたニーズに応えられるサービスを充実させて頂きたいと思います。引越しと違って運搬の距離がない点、梱包などを自前でも行える点、作業時間が比較的少なくて済む点などを考慮して頂けるとありがたいです。
459,2021-08-01,非常に仕事も丁寧で良かった,5.0,良かった点は、仕事が丁寧で早く、スタッフの皆さんも明るかったです。見積りの電話で話した方、現場の作業員の方、皆気持ちよい対応でした。悪かった点は、特にありません。感想としては、初めて使いましたがまた、引っ越しの時はお願いしたいなと思います。
448,2021-08-01,作業が迅速で対応も良かった。,4.75,指定の時間にしっかり対応してくれた。梱包が不十分でも臨機応変にしてくれた。引っ越し先での家具の移動も対応してくれた。
456,2021-08-01,とてもサービスが良い,5.0,電話対応からお見積りも対応が大変早く良かったトラック作業員もユーザーの要望通りに作業していただき、サービスがいい業者だなっていう印象でした
