,date,title,rate,comment
1538,2020-02-22,シンプルで安い,4.25,見積りに来てくれた営業の方の対応が凄く良かった。営業の方は一度顔を合わせるだけかと思っていたが、資材を持ってきてくれるときや、引っ越し当日まで挨拶に来てくれてとても感じの良い方で、スケジュールについても調整してもらえて助かった。対して電話対応の方は感じが悪かったので、残念な気持ちになった。作業員の方は皆テキパキしていて、スピーディーでした。他社と比べて段ボールの引き取りが無いので、とにかく値段を安くシンプルに引っ越したいときには良いと思います。他社で金額が数千円しか違わないところがあり、そこは段ボール引き取り無料なので、次はそちらを利用してみようかなと思っています。
1539,2020-02-22,親切でよかった,3.75,客に対しての話し方は丁寧だったが、社員同士の会話が上下関係があるためなのか、話し口調が側から聞こえて怖かった。
1475,2020-02-22,電話の営業さんは頑張っているのが伝わりました。,2.75,事前の見積もりの際に何を運ぶか伝えてあり、その他の部分は当日に、というお話でしたが、実際に現場では、1つずつ運ぶものを伝えてくれ、と言われ、いきなり言われてもメモも用意しておらず…伝えてあった鏡は運ばれずに残っていました。
1536,2020-02-23,素早い,3.0,いい点対応が早い安い素早く梱包して持ち出ししてもらえた悪い点次の仕事を急がないとという感じがすごくする
1537,2020-02-23,とても親切な対応でした。,4.0,とても親切に応対してくださって、引っ越しとは関係ない大きな荷物を移動させることのお願いも、気持ちよく手伝っていただけて、本当に有りがたかったです。費用的には、他社さんと変わらない感じでした。ただ、時間の指定に午前か午後かを限定するのにも料金がかかると言われてしまい、用事もあったのでいつになるか連絡がくるまでヒヤヒヤでした。実は契約したあと他社から連絡があり、そちらは午前か午後の指定にはお金がかからないと言われ、複雑な気持ちになりました。
1535,2020-02-23,とても親切に対応して下さりました,4.75,急な予定変更にも嫌な顔をされずに親切に対応して下さりありがとうございました。当初はもう少しお安く出来るものだと思っておりましたしさらに日数的にもまだまだ繁忙期には掛からないと思っておりました。ところが他社さんは繁忙期だ、値段は全然合わないわとにかく高いわで。途方に暮れておりましたがハートさんはそんな事を物ともせずベストな値段を提示して下さりました。それに日時も希望通りで大変満足しております。ありがとうございました。
1533,2020-02-23,挨拶良くてスピーディーで良かった！,4.5,対応は良かった。でもダンボールはS.M.Lちゃんとつけてほしかった。少しサイズが小さいから結局は自分で買ってたのでそこは改良せなあかんと思う
1530,2020-02-23,良し悪しの差が大きい,3.75,初めの電話対応は良かったが、２回目以降の電話対応の女性は冷たく、値引き交渉もしてもらえたが、こちらが罪悪感を感じた。またこちらの伝えた情報が電話では合っていたのに、書面での見積りでは複数間違っていたが、一言も謝罪がなかった。ましてや、一方的に話すのが、不快感にも。契約が決まれば、そういう対応になるのかもしれない。対して、当日運んでくださった方々は、丁寧でスピーディーで素晴らしかった！ただ、エアコンが思いの外値段がかかり、仕方ないとわかっていても、結局結構高くついた。
1531,2020-02-24,良かった         ,4.0,道が細く、トラックが庭迄入って来れなく、運ぶ距離が増えてしまったが手早くやってくれた。追加料金なし。
1512,2020-02-25,東京の方は丁寧でよかった,4.25,大阪の引越し業者さんは少し雑だった。ベッドにガムテの痕が着いていました。東京の方は丁寧に作業していただいたので大変良かったです
1522,2020-02-25,最後まで丁寧な対応でした。,4.75,搬送だけでなく取り付け工賃なども細かく説明頂き満足な料金を提示していただきました。作業も丁寧で、汗をかきながらも最後まで笑顔で対応していただき感謝しています。
1526,2020-02-25,とても良かったです,5.0,自分の希望の金額で長野県から東京都までの引っ越しをしていただきました。電話対応の時点でとてもわかりやすい説明と対応でした。
1527,2020-02-25,安心できる,5.0,電話の見積りをしてくださって思ってたよりも安かったのでお願いしました。当日は爽やかな印象でてきぱきお仕事してくださって良かったです。
1516,2020-02-26,値段が安くサービス面も良かった,5.0,いろいろな業者に見積もりして頂いて月末という時期もありどこも7万円近くしていたのですが洗濯機設置も含め5万円台で抑えて頂けたので即決しました。電話での対応も良く、ダンボールもプレゼントで無料で回収もしてくれるのでサービス面から考えても思っていたより安かったと思います。当日は愛想のいいお兄さんが3人来てとてもスピーディに積み込みをして頂けました。クローゼットの洋服をそのままかけて運んでもらえる衣装ケース？もとても便利でした。ハート引越センターは(単身パックの場合)他社よりも断然安く引越しできると思うのでオススメです。また引越し当日の訪問時間やダンボールのお届け時間は希望日の3日前に電話でお知らせという形になっているためお忙しい方は値段は少し上がりますが時間指定をする事をおすすめします。
1490,2020-02-26,丁寧に対応してもらいよかった。,3.75,ダンボール、ガムテープ等を自分希望する個数を無料でもらえ、そして家まで運んでもらえた。ある程度であれば個数に制限がなく便利であった。前日でも荷物変更にもすぐに対応してもらいよかった。家財一覧にない物は電話で言ったら得点を加算してもらえてよかった。当日多少追加の荷物もあったが運んでいただいた。他社では5万円が多かったが、今回お願いした業者では3万円で引越しをすることができたのでとても満足している。荷物を新居に運んでもらうとき、レイアウトで家具、家電の位置を調節、移動してもらえて、丁寧に対応してもらいよかった。引越し後1週間ぐらい？であればダンボールを無料で引き取ってもらえるサービスがあり、便利であると思う。引越しシーズンは値上がりするので、なるべく時期を考えて引っ越しをしていけばよかったなと思う。
1507,2020-02-26,スピーディーに対応してくださいました,4.0,今まで、引越し会社と違ったので不安でしたが、値段も安くついたし、荷物も丁寧に扱ってもらえたので良かったです。
1473,2020-02-26,親切丁寧と感じた,5.0,一括見積をしたが、見積もり時の営業マンも柔和で親切味あふれていた。一方ゴリゴリに契約をしようとしたり全く営業気がない営業マンもおり、営業マンの人間味で選択したといっても過言ではない。そして見積もりの営業の人から、その後の質問時の電話対応まで一貫して丁寧であった。作業もてきぱきと丁寧にやっていただいた。非常に満足している。また引っ越し時には利用したいと思う業者であった。
1508,2020-02-26,まあまあだった,3.25,見積もりが甘かったみたいで営業と作業員の認識に違いがあったみたいでした。ただ、それを客に言われても困るのでもう少し紳士的な対応が欲しかった。
1509,2020-02-27,良い,3.75,良かった点大体、予定通りの金額でした。悪かった点平日フリー契約にしたので時間帯が遅かったり、早かったこと。
1521,2020-02-27,丁寧なのに話しやすい,5.0,見積もりから作業まで関わる全ての人が丁寧で気さくです。2度目の利用でしたが機会があれば必ず依頼します。効率がいいからか作業時間もすごく短く済みました。
1517,2020-02-27,電話対応は冷たかったが、作業員さんは親切だった。,3.5,予想していた金額よりも高くなったが、一番見積もりで安い所に決定。電話対応は事務的で冷たい感じがしたが作業員さんの対応が親切でよかったので頼んでよかったと思う。
1520,2020-02-28,確認不足、詰めが甘い,2.5,以前も利用したことがあり二ヶ所積みが出来るので利用しましたが住所は間違えるし、前日に連絡も無くメールしてると言われても来ていないのに突然来るし、当日のセンターから電話も非常に嫌味な言い方搬入先に早く行け的な言い方をされ、前もってきちんと連絡をもらっていれば片付けも終わっていたと思いますので今後は利用しないです。アートさんとかも利用しましたが大手のが安心できるし対応良いし少し高くても安心できる会社を選びましょう。安かろう悪かろうになってしまいますし新築なら尚更大手の訓練された業者さんが良いと思います。今回の件で痛感しました。今回の業者さんは3度目の候補では無くなりました。引越し屋さんで住所間違いは致命的ですし、地図アプリとかで搬出搬入先位は確認出来ると思います。メールで住所送ってるのに違う住所で見積りが来るしで大変な１日になりました。
1515,2020-02-28,愛想がいい感じがした,4.75,初めて引越し業者さんにお願いしました。見積もりの時点ではここにすると決めていませんでした電話で割引をしてもらい、雰囲気も良かったことからここに決めました。その後同じ料金内で荷物内容の変更もでき、とても融通のきくところだと思います。ただ、梱包の際スピードは速いのですが、大雑把な感じがしました。他の業者を知らないので、引っ越しがこういう感じで梱包されるのが普通なのかはわかりませんが、そういう印象を受けました。
1519,2020-02-28,作業員の人も良い人で、素早く、頼んでよかった。,5.0,作業員の人も、良い人達で、作業が早く、凄くスムーズに引っ越しが終わった。値段が1番安かったので良かった。
1518,2020-02-28,ご親切に対応して下さりとても助かりました。,4.75,初めての引っ越しで、色々分からない事がありましたが一つ一つ答えて下さったおかげで当日はスムーズに出来ました。
1510,2020-02-29,営業の方は対応が良かった。,3.25,【見積もり時の対応】スピーディーな対応でした。【料金】会社払いだったので安いところ優先だったが､思っていたより安かった｡【作業内容】作業内容は最悪でした。今まで４度引っ越しして､初めてハートさんでしたが酷かったです。【全体的な評価】会社が安いところで決める感じだったので今回は仕方ないが、自分払いなら選ばない｡【良かった点】作業が雑な分、早かったかな…【気になった点】ソファーの組み立てが､やったことないタイプだったようで悪戦苦闘して､なんとか出来たようでしたが、帰られてからワッシャーが、ポツンとじゅうたんに…
1514,2020-02-29,引っ越し料金が想定より安く、満足しております。,5.0,引っ越し料金が安く、当日の作業がとてもスピーディーで作業員の印象も非常に良かったので満足しております。
1457,2020-02-29,他社と比較してコストパフォーマンスが良い。,4.75,繁忙期にも関わらず、良心的な価格設定で非常に助かりました。資材も無料で十分な量用意して頂き、引っ越し後の資材の回収も無料でしていただけたので便利でした。是非またお願いしたいです。
1511,2020-03-01,仕事がとても早く丁寧に対応してくださいました。,5.0,引越し業者を使うか迷っていたのですがやっぱりプロにお任せして良かったと思いました。電話対応してくださいました女性の方が少し印象が悪かったですが概ね満足です。
1489,2020-03-02,コストパフォーマンス最高,4.25,３月上旬の引越しです。はじめ大手の他社で見積もりをしてもらったところ、約20万円。今日契約していただけたら15万＋税でやります、とのこと。食器用ケースのレンタルなど、サービスは良さそうでした。ハートさんの見積もりでは、７万＋税。10万までしか出せないと思っていましたが、それを下回る価格でした。段ボール、ふとん袋サービスのみでしたがそれで十分だと思いました。また今すぐ契約したらの値段でもなく、焦らすことがなかったのが好印象だったので、決めました。当日は若いお兄さん２人と女性の方が作業に来られました。礼儀正しく、丁寧に対応していただけました。何度か引越しをしており、いろいろな会社さんにお世話になりましたが、ハートさんは価格とサービスがちょうど良く、とても気持ちのよい引越しとなりました。
1494,2020-03-02,対応が早い,5.0,●見積もり依頼一括見積もりを依頼したが、返信がきたのが4社しかなく、実際に訪問見積もりで来てもらえたのが3社だった。引っ越し時期が3月で繁忙期だったにもかかわらず対応して頂けた3社は、とても迅速丁寧に訪問見積もりをしてくれました。繁忙期で、一括見積もりでさえ対応して頂ける業者が少なく、個人で探していたら、とても時間がかかって大変だった思います。●見積もり金額ハート引っ越しセンターさんと他社さんの一回目の見積もりでは、他社さんの金額がハートさんの倍高い見積もり金額で驚きました。その後の交渉で、他社さんも値引いて下さいましたが、ハート引っ越しセンターさんが一番安かった為、ハート引っ越しセンターさんに引っ越しを依頼しました。●ハート引っ越しセンターさんの良い点金額が安かった事もありますが、他の決め手は、不要品を処分して頂けた事です。他2社は、不要品の処分対応がない為、大型の食器棚の処分を悩んでいたが、ハートさんは、引っ越し時の荷物と一緒に処分してもらえるので、引っ越し日まで食器棚を使用できて、とても助かりました。処分金額も個別に処分業者に依頼するより安かったので良かったです。
1487,2020-03-03,電話連絡や作業もきっちりしていて良かった,4.75,会社が決まるまでの値下げ合戦の凄さにびっくりしました。最後の決め手は値段では無く親身になってアドバイスをくれた方に決めました。
1481,2020-03-03,非常に良かった,4.5,【見積もり時の対応】電話、訪問の両方で非常に良かった【料金】安かった【作業内容】丁寧で良かった【全体的な評価】非常に良かった【良かった点】【気になった点】
1499,2020-03-03,とても感じがよかったです。,4.75,積込の際も荷下ろしの際も作業員の方々の感じがとてもよく、手際もよかったです(1K→一戸建ての2階への引越しで、どちらも作業時間は1時間程度でした)。作業終了時も「他になにかお手伝いすることはありますか？」など、丁寧に声掛けしてくれました。電話での見積もり時にお伝えしたよりも荷物の量が多くなってしまったのですが、前日までに電話で連絡をすると対応していただけました。見積もり時も、その後の連絡時も、気持ちよく対応していただき、総じてとても印象がよかったです。段ボールも無料で配送、無料引取で、とても助かりました。3月は繁忙期にあたるかと思いますが、上旬の平日だったためか、お安く運んでいただけてありがたかったです。今回の利用前は知らなかったのですが、別の地域に住む知人もハート引越センターを利用したことがあるらしく、それも良い評判を聞いて決めたそうですので、感じの良い人が多いのかもしれません。
1502,2020-03-03,素早く丁寧でした。,4.5,重い荷物にも関わらずエレベーター無しの４Fまで運んでくれただけでも本当に有難い。ありがとうございました。
1506,2020-03-03,見積もり時の対応も圧迫感がなく好対応,4.25,スピーディーかつ好対応見積もり時も他の大手引越し業者さん達は今決めたら今決めたらって圧力をかけてきましたけどハートさんはほんとに好対応でした。当日もとことんスピーディー！好対応でした！
1492,2020-03-04,明るくて元気な雰囲気でした,4.0,　傷がつかないように家電製品などを覆ってくださり私達で運ぶのが困難な冷蔵庫や洗濯機も素早く運んでくださりテキパキ動いてくださっていることにとても感謝しております。また少ない残りの荷物も1階まで運んでくださったり、配慮が凄いよかったなと身に染みております。　引越し先へ少しお待たせしてしまいましたが最後まで運んでくださりありがたい気持ちです。　1つ残念だったのは3人のうち1人布団を自分の布団ケースに入れた状態で運んでもらう際に、階段で落ちそうになっているのを手で抑えずに歯で噛んで抑えている光景を家族が目にした際に、私も家族も少し引いてしまいました。またリーダー的な方はコツコツと動いてらっしゃいましたが残りの2人でずっと会話を続けており後半から物を運ぶのを適当な感じでやられていたのが少し残念でした。しかし自分では中々1日で終えることが出来なかった作業も半日で終えることが出来ましたので引越し業者の方に感謝しておる他、料金や日にちを色々考慮してくださりありがとうございました。引越しの荷造りをする前に必要な物と不必要な物を分別して必要なものは小分けにしてダルボールに入れておくと運びやすいし、整理整頓しやすいなと改めて思いました。
1466,2020-03-05,皆さん親切でした。,4.5,繁忙期にも関わらず、見積もりご担当の方のご尽力により、大幅な値引までしていただき、本当に助かりました。問合せから、見積もり訪問までも一番対応が早く、決めさせていただきました。
1503,2020-03-05,担当者の対応が大変良く、当日作業も迅速丁寧だった。,5.0,娘が広島から地元に帰る事になり、電話受付していただいたハート引越しセンター広島店の担当者さんの対応が大変良く、親子間で荷物量の勘違いから、度々電話をしてしまいましたが嫌な感じも一切ありませんでした。見積もりも遠方にもかかわらず他者と比較しても安く済み、作業も迅速丁寧で予定していた時間より早く帰宅する事が出来て助かりました。
1505,2020-03-05,とても誠実に感じました,4.5,引越し荷物がポイント制だと聞き、この荷物は何ポイントなので、まだ大丈夫だと、具体的に数値化されていたので、ポイント最大限まで、こちらも荷物の選定が出てきて大変よかった。
1474,2020-03-06,手際がよかった,4.0,よかった点訪問見積もりでなく、電話での見積もりをしてもらえた何度も荷物の点数の訂正をおこなったが、金額も変わらず対応がよかった
1495,2020-03-06,会社の社風が良く、教育、指導が徹底出来ています。,5.0,見積もりは的確かつ良心的で有りましたし対応はスピーディーでした。他社さんより安い。ダンボールも荷出しの前【希望日】に届けていただきました。荷出しの対応もテキパキとしていただきました。時間もかからずかなり早く荷出しができました。荷物搬入もスムーズでしたし、どこにどう配置するかきちんと確認してくれました。仕事も丁寧で綺麗な仕事ぶりです。担当の方々も大変感じ良かったです。空いたダンボールは希望が有れば後日取りに来ていだけると言っていただきました。次引っ越しが必要な時も是非使わせていただきたいです。又知人や友人にも是非紹介したいと思います。ありがとうございました
1496,2020-03-06,きちんとした言葉遣いで丁寧な対応が好印象でした,4.5,訪問見積もりの際、子供に気を配っていただいたり、言葉遣いもとても丁寧でした。他社さんに比べても、とても話しやすい雰囲気を作っていただき、終始和やかに見積もりをしていただけました。訪問見積もり前に連絡をいただけなかった引っ越し業者さんもいらっしゃった中、訪問時間前に事前連絡をいれていただき、時間通りにいらしていただいた点も好印象でした。子供がいるため、このようにきめ細かな対応がとても好印象となりました。また、部屋の外にある自転車やベビーカーにもいち早く気づき、見積もり時にこちらももっていかれますか？と聞いていただき、自分たちだと忘れてしまっていた点に気づいていた点もプロだなあと感じました。今回の訪問見積もりがとても印象が良かったので、他に同料金の引っ越し会社もありましたが、信頼できると感じたため、今回契約をさせていただきました。
1479,2020-03-08,盛岡側の作業員さんは親切、丁寧、迅速で好印象でした,4.75,引っ越し先の神戸配送センターの荷下ろしは早いけど部屋割り通りに入れない、水物の上に重いものを乗せた為ウオーターサーバーの水の箱が潰れて水が流れ出す始末オマケに神戸配送センターに盛岡配送センターを通じて電話をしたが連絡は翌日しかも督促の電話を入れてからやっと連絡が来る状態しかも言い訳をする、盛岡配送センターのスタッフさんは、感じが大変良かったのに対して神戸配送センター雑な仕事営業所が違うとこうも違うものかと痛感しました
1500,2020-03-08,無理なお願いも快く引き受けてくれた,5.0,もともとはテレビと洗濯機のみの引越しをお願いしていたのだが、冷蔵庫を一階に下ろすだけのオプションを後日お願いしたが、二つ返事で了解いただけた。3月の忙しい日程の中、割安で仕事いただけて、非常にありがたかった。他社はトラック一台と作業員2名で3万5千円程度が限界であったが、契約した会社は運ぶ荷物を限定する代わりに限界まで安くしていただけた。3月に洗濯機の取り付け料込みで2万5千円はかなり安いのではないでしょうか。また、一部の引っ越し会社の、他社の悪口や運送物の破損や家財の損傷をやたらに煽り、安心保証を付けさせ、安心・安全を前面に押し出して契約を迫ってくる態度には辟易した。さらには、値段を下げられないなら断る、と明確に断っているにもかかわらず、なおも食い下がり、家具家電が壊れたときの話ばかりして霊感商法のような営業をされたことには怒りを覚えた。ハート引っ越しセンターはそのようなことがなく好感を持てた。
